author,created_utc,title,url
kaiser44de,1581969121,Spread of Coronavirus in February,https://www.youtube.com/watch?v=LGAGVuAT9cg&amp;feature=youtu.be
121kiwi,1581969211,Beijing Auto Show postponed due to coronavirus,https://121private.home.blog/2020/02/17/beijing-auto-show-postponed-due-to-coronavirus/
SourBogBubbleBX3,1581940968,"BOOM Scientists Now Say Coronavirus Probably Man Made From Chinese Lab, Its Gunna Get BAD",https://youtu.be/_FRRgKBBmAE
121kiwi,1581944019,Impact of coronavirus on world economy to be temporary: experts,https://121private.home.blog/2020/02/17/impact-of-coronavirus-on-world-economy-to-be-temporary-experts/
slightlyintoout,1581947820,Coronavirus: Tokyo Marathon organisers restrict event to elite runners only,https://www.bbc.com/sport/athletics/51531946
fatouakinajma,1581949604,Coronavirus panic led to Hong Kong toilet paper theft at knifepoint: police,https://zoom-viral.com/news/coronavirus-panic-led-to-hong-kong-toilet-paper-theft-at-knifepoint-police/?feed_id=99620&amp;_unique_id=5e4aa2a4845f7
neroo-news-en,1581992413,13 US evacuees from coronavirus-hit Japan cruise ship being treated in Nebraska,https://en.neroonews.com/13-us-evacuees-from-coronavirus-hit-japan-cruise-ship-being-treated-in-nebraska/
fatouakinajma,1581987398,"Coronavirus news: Panic erupts as 1,500 people tested for killer virus in one day | World | News",https://zoom-viral.com/news/coronavirus-news-panic-erupts-as-1500-people-tested-for-killer-virus-in-one-day-world-news/?feed_id=100505&amp;_unique_id=5e4b36461444c
s00126,1581994364,North Korean official reportedly executed for breaking coronavirus quarantine.,https://www.google.com.tw/amp/s/nypost.com/2020/02/13/north-korean-official-reportedly-executed-for-breaking-coronavirus-quarantine/amp/
peekahole,1582018637,"L.A. Officials Say Asian Teen Was Assaulted, Bullied Over Coronavirus Fears",https://www.google.com/amp/s/m.huffpost.com/us/entry/us_5e4749f4c5b64ba2974faf29/amp
121kiwi,1582083562,Coronavirus: Passengers allowed to leave cruise ship,https://121private.home.blog/2020/02/19/coronavirus-passengers-allowed-to-leave-cruise-ship/
121kiwi,1582051169,China cracks down on VPNs in bid to control coronavirus message,https://121private.home.blog/2020/02/18/china-cracks-down-on-vpns-in-bid-to-control-coronavirus-message/
121kiwi,1582051178,Chinese gov’t mourns hospital chief who died in coronavirus fight,https://121private.home.blog/2020/02/18/chinese-govt-mourns-hospital-chief-who-died-in-coronavirus-fight/
katysha1234,1582061983,British couple on Diamond Princess question positive coronavirus test,https://londondailyreport.com/british-couple-positive-coronavirus-test/
Ippnoida,1582026651,Coronavirus impacting the industry and upcoming trade fairs,https://indianprinterpublisher.com/blog/2020/02/18/coronavirus-impacting-the-industry-and-upcoming-trade-fairs/
zoomkatz,1582022961,"Coronavirus causes mild disease in four in five patients, says WHO | World news | The Guardian",https://www.theguardian.com/world/2020/feb/17/coronavirus-causes-mild-disease-in-four-in-five-patients-says-who
neroo-news-en,1582028411,Apple warns of worldwide iPhone shortages due to coronavirus disruption,https://en.neroonews.com/apple-warns-of-worldwide-iphone-shortages-due-to-coronavirus-disruption/
121kiwi,1582033160,More passengers to leave cruise ship in Cambodia after coronavirus tests,https://121private.home.blog/2020/02/18/more-passengers-to-leave-cruise-ship-in-cambodia-after-coronavirus-tests/
agumonkey,1582048563,Harvard expert says coronavirus likely now ‘gathering steam’,https://news.harvard.edu/gazette/story/2020/02/harvard-expert-says-coronavirus-likely-just-gathering-steam/
OlinLive,1582048509,"Coronavirus 72,500 Infected, Wuhan-400 Predicted Coronavirus 40 Years Ago",https://www.youtube.com/watch?v=MhrjL_HARM4
121kiwi,1582054766,USA TODAY reporters answer readers’ questions about coronavirus live. See it here,https://121private.home.blog/2020/02/18/usa-today-reporters-answer-readers-questions-about-coronavirus-live-see-it-here/
121kiwi,1582090750,Oil gains as optimism grows economic impact of coronavirus outbreak may be brief,https://121private.home.blog/2020/02/19/oil-gains-as-optimism-grows-economic-impact-of-coronavirus-outbreak-may-be-brief/
121kiwi,1582097968,"Coronavirus, Syria, Ben Affleck: Your Wednesday Briefing",https://121private.home.blog/2020/02/19/coronavirus-syria-ben-affleck-your-wednesday-briefing/
121kiwi,1582097970,Coronavirus: Hotel rooms and coach tours cancelled in Northern Ireland,https://121private.home.blog/2020/02/19/coronavirus-hotel-rooms-and-coach-tours-cancelled-in-northern-ireland/
121kiwi,1582022359,Taiwan to evacuate citizens from coronavirus-hit ship in Japan,https://121private.home.blog/2020/02/18/taiwan-to-evacuate-citizens-from-coronavirus-hit-ship-in-japan/
121kiwi,1582018774,China’s facial-recognition giant says it can crack masked faces during the coronavirus,https://121private.home.blog/2020/02/18/chinas-facial-recognition-giant-says-it-can-crack-masked-faces-during-the-coronavirus/
121kiwi,1582029569,Wuhan hospital chief dies from coronavirus,https://121private.home.blog/2020/02/18/wuhan-hospital-chief-dies-from-coronavirus/
fatouakinajma,1582057188,Coronavirus UK latest: Medical CRISIS fears as 'essential' everyday drugs face RATIONING | UK | News,https://zoom-viral.com/news/coronavirus-uk-latest-medical-crisis-fears-as-essential-everyday-drugs-face-rationing-uk-news/?feed_id=102042&amp;_unique_id=5e4c46e43c1f3
fatouakinajma,1582059454,Coronavirus concerns prompt Russia to bar Chinese citizens on temporary basis,https://zoom-viral.com/news/coronavirus-concerns-prompt-russia-to-bar-chinese-citizens-on-temporary-basis/?feed_id=102075&amp;_unique_id=5e4c4fbe4a44b
121kiwi,1582061960,Dairy prices fall as coronavirus outbreak takes toll on trade,https://121private.home.blog/2020/02/18/dairy-prices-fall-as-coronavirus-outbreak-takes-toll-on-trade/
WikiKnowledge,1582076853,Coronavirus: Self-quarantined family shunned as neighbour calls 911 on them,https://www.wikiknowledge.ml/2020/02/coronavirus-self-quarantined-family.html
121kiwi,1582097969,Coronavirus: First passengers disembark from Diamond Princess in Japan,https://121private.home.blog/2020/02/19/coronavirus-first-passengers-disembark-from-diamond-princess-in-japan/
121kiwi,1582097961,"News Daily: Immigration plans, Brit Awards and coronavirus",https://121private.home.blog/2020/02/19/news-daily-immigration-plans-brit-awards-and-coronavirus/
121kiwi,1582083565,Coronavirus: Passengers allowed to leave cruise ship,https://121private.home.blog/2020/02/19/coronavirus-passengers-allowed-to-leave-cruise-ship-2/
neroo-news-en,1582071611,Opinion: Apple coronavirus warnings highlight complexities of tech supply chains,https://en.neroonews.com/opinion-apple-coronavirus-warnings-highlight-complexities-of-tech-supply-chains/
Gistmania,1582065665,"""Coronavirus Is Caused By Corruption"" - EFCC Boss, Magu Says (VIDEO)","https://www.gistmania.com/talk/topic,455275.0.html"
121kiwi,1582090751,Chinese envoy says exchanges with India not to be affected by novel coronavirus,https://121private.home.blog/2020/02/19/chinese-envoy-says-exchanges-with-india-not-to-be-affected-by-novel-coronavirus/
121kiwi,1582069164,Coronavirus Infections Jump to 57 in Sichuan’s Tawu County,https://121private.home.blog/2020/02/18/coronavirus-infections-jump-to-57-in-sichuans-tawu-county/
neroo-news-en,1582068026,"China coronavirus death toll rises to 2,000",https://en.neroonews.com/china-coronavirus-death-toll-rises-to-2000/
121kiwi,1582094358,Dissent becomes the next victim of coronavirus as China cracks down,https://121private.home.blog/2020/02/19/dissent-becomes-the-next-victim-of-coronavirus-as-china-cracks-down/
121kiwi,1582022359,Fashion house Chanel cancels Beijing show due to coronavirus,https://121private.home.blog/2020/02/18/fashion-house-chanel-cancels-beijing-show-due-to-coronavirus/
121kiwi,1582025973,What is coronavirus and what should I do if I have symptoms?,https://121private.home.blog/2020/02/18/what-is-coronavirus-and-what-should-i-do-if-i-have-symptoms-3/
HindustanNewsBharat,1582083634,Coronavirus: Viral videos show funny side of deadly 'COVID-19',https://timesofindia.indiatimes.com/videos/news/coronavirus-viral-videos-show-funny-side-of-deadly-covid-19/videoshow/74194532.cms
neroo-news-en,1582035611,Cambodia PM defends ship docking despite coronavirus diagnosis,https://en.neroonews.com/cambodia-pm-defends-ship-docking-despite-coronavirus-diagnosis/
121kiwi,1582040365,Chinese hospital director dies from coronavirus despite ‘all-out’ efforts to save his life,https://121private.home.blog/2020/02/18/chinese-hospital-director-dies-from-coronavirus-despite-all-out-efforts-to-save-his-life/
121kiwi,1582036782,Entertainment apps see surge in active users amid coronavirus outbreak,https://121private.home.blog/2020/02/18/entertainment-apps-see-surge-in-active-users-amid-coronavirus-outbreak/
SourBogBubbleBX3,1582042877,Head Of Hospital At Epicenter Of Coronavirus Outbreak Has Died | TODAY,https://youtu.be/QVVcHgxin0E
piind,1582053582,Coronavirus cured!,https://www.google.com/amp/s/www.thesun.co.uk/news/10958147/north-korea-executes-coronavirus-patient/amp/
neroo-news-en,1582046421,Report: Coronavirus won’t delay March’s iPhone SE 2/iPhone 9 launch,https://en.neroonews.com/report-coronavirus-wont-delay-marchs-iphone-se-2-iphone-9-launch/
neroo-news-en,1582050013,How the coronavirus is impacting the global tech industry,https://en.neroonews.com/how-the-coronavirus-is-impacting-the-global-tech-industry/
neroo-news-en,1582050009,Iran interior minister urges health minister to conceal coronavirus info: Report,https://en.neroonews.com/iran-interior-minister-urges-health-minister-to-conceal-coronavirus-info-report/
neroo-news-en,1582060820,92 cases of human-to-human coronavirus cases outside China: WHO,https://en.neroonews.com/92-cases-of-human-to-human-coronavirus-cases-outside-china-who/
thedeathofillusion,1582063526,Singapore downgrades 2020 economic growth forecast to between -0.5 and 1.5% on coronavirus impact - recession likely.,https://www.straitstimes.com/business/economy/singapore-downgrades-2020-economic-growth-forecast-to-05-15-on-coronavirus-impact
121kiwi,1582047553,African countries debate repatriating citizens from China as coronavirus fears mount,https://121private.home.blog/2020/02/18/african-countries-debate-repatriating-citizens-from-china-as-coronavirus-fears-mount-2/
ml5c0u5lu,1582087866,5 US cities to start testing patients with flu like symptoms for the coronavirus,https://www.nbcnews.com/health/health-news/5-u-s-cities-start-testing-patients-flu-symptoms-coronavirus-n1136941
neroo-news-en,1582089628,Another person dies in Hong Kong due to coronavirus,https://en.neroonews.com/another-person-dies-in-hong-kong-due-to-coronavirus/
121kiwi,1582015168,Coronavirus LIVE: China ‘rounding up’ patients as British couple contract deadly disease,https://121private.home.blog/2020/02/18/coronavirus-live-china-rounding-up-patients-as-british-couple-contract-deadly-disease/
121kiwi,1582076377,"Chinese hospitals discharge 14,376 recovered patients of coronavirus infection",https://121private.home.blog/2020/02/19/chinese-hospitals-discharge-14376-recovered-patients-of-coronavirus-infection/
star_o_mega,1582023979,The author predicted the coronavirus 40years ago.,https://www.news18.com/news/buzz/did-a-chinese-novel-predict-coronavirus-40-years-ago-wuhan-400-leaves-twitter-baffled-250440
121kiwi,1582126761,"With stricken cruise ship, Japan draws criticism over coronavirus response",https://121private.home.blog/2020/02/19/with-stricken-cruise-ship-japan-draws-criticism-over-coronavirus-response/
C0VID-19,1582133293,Coronavirus could start to empty shelves in some U.S. stores by mid-April,https://www.detroitnews.com/story/business/2020/02/12/target-best-buy-coronavirus-supply-disruption/41223461/
121kiwi,1582137558,Sony Just Canceled Its PAX East 2020 Attendance Because of the Coronavirus,https://121private.home.blog/2020/02/19/sony-just-canceled-its-pax-east-2020-attendance-because-of-the-coronavirus/
neroo-news-en,1582138882,Coronavirus kills two Iranian citizens located in Qom,https://en.neroonews.com/coronavirus-kills-two-iranian-citizens-located-in-qom/
theEvolutionMusic,1582178005,Latest update on coronavirus::: First 3D map of virus is made,https://e-stark.blogspot.com/2020/02/latest-update-on-coronavirus-first-3d.html
JamesCorden19,1582168209,"China reports drop in coronavirus cases, but scientists warn virus may spread easily",https://www.channelnewsasia.com/news/asia/china-hubei-coronavirus-covid-19-cases-spreads-sars-12452240
121kiwi,1582180765,China donates a batch of novel coronavirus test kits to Japan,https://121private.home.blog/2020/02/20/china-donates-a-batch-of-novel-coronavirus-test-kits-to-japan/
121kiwi,1582184369,WHO affirms novel coronavirus pneumonia is not lab-created,https://121private.home.blog/2020/02/20/who-affirms-novel-coronavirus-pneumonia-is-not-lab-created/
121kiwi,1582184372,Coronavirus travel restrictions extended,https://121private.home.blog/2020/02/20/coronavirus-travel-restrictions-extended/
121kiwi,1582108759,China expels Wall Street Journal reporters over ‘racist’ headline on coronavirus op-ed,https://121private.home.blog/2020/02/19/china-expels-wall-street-journal-reporters-over-racist-headline-on-coronavirus-op-ed/
121kiwi,1582101557,Shanghai reports no new confirmed case of coronavirus infection,https://121private.home.blog/2020/02/19/shanghai-reports-no-new-confirmed-case-of-coronavirus-infection/
pakistantody,1582111997,"New coronavirus cases in China fall for second day, deaths top 2,000",https://youtu.be/WrlUveb-jpA
mamun2220,1582161120,"Two die of coronavirus in Iran, first fatalities in Middle East",https://www.aljazeera.com/news/2020/02/die-coronavirus-iran-fatalities-middle-east-200219171007605.html
121kiwi,1582108765,WHO says no indication of coronavirus cases in North Korea,https://121private.home.blog/2020/02/19/who-says-no-indication-of-coronavirus-cases-in-north-korea/
Spare-Link,1582110144,Coronavirus,https://youtu.be/HUSS60yCb8Q
121kiwi,1582115956,Lancet releases statement supporting Chinese scientists amid coronavirus fight,https://121private.home.blog/2020/02/19/lancet-releases-statement-supporting-chinese-scientists-amid-coronavirus-fight/
lollerbladder,1582149052,Breakthrough in Coronavirus Research Results in New Map to Support Vaccine Design,https://news.utexas.edu/2020/02/19/breakthrough-in-coronavirus-research-results-in-new-map-to-support-vaccine-design/
neroo-news-en,1582149689,Sony cancels its PAX East plans due to coronavirus fears,https://en.neroonews.com/sony-cancels-its-pax-east-plans-due-to-coronavirus-fears/
121kiwi,1582166355,Family of Four Likely the First Cases of Uyghurs Contracting Coronavirus in XUAR,https://121private.home.blog/2020/02/20/family-of-four-likely-the-first-cases-of-uyghurs-contracting-coronavirus-in-xuar/
121kiwi,1582184364,London can host 2020 Games if moved over coronavirus: mayor candidate,https://121private.home.blog/2020/02/20/london-can-host-2020-games-if-moved-over-coronavirus-mayor-candidate/
neroo-news-en,1582153288,Coronavirus study pinpoints African nations’ vulnerabilities,https://en.neroonews.com/coronavirus-study-pinpoints-african-nations-vulnerabilities/
BirchandBees,1582153640,Two positive cases of coronavirus confirmed in Iran,https://en.isna.ir/news/98113022673/2-positive-cases-of-coronavirus-confirmed-in-Iran
neroo-news-en,1582167663,"China’s Hubei reports 349 new coronavirus cases, lowest since Jan 25",https://en.neroonews.com/chinas-hubei-reports-349-new-coronavirus-cases-lowest-since-jan-25/
121kiwi,1582169959,Coronavirus: Walking through Beijing’s near empty streets,https://121private.home.blog/2020/02/20/coronavirus-walking-through-beijings-near-empty-streets/
scorpionman,1582106230,iPhone 9: Coronavirus are un IMPACT mai MARE decat se Credea,https://www.idevice.ro/2020/02/19/iphone-9-productie-coronavirus-403994/
121kiwi,1582177157,A cluster of coronavirus cases in South Korea has been traced to a cult,https://121private.home.blog/2020/02/20/a-cluster-of-coronavirus-cases-in-south-korea-has-been-traced-to-a-cult/
neroo-news-en,1582182090,China ‘trying very hard’ in handling coronavirus outbreak: Trump,https://en.neroonews.com/china-trying-very-hard-in-handling-coronavirus-outbreak-trump/
121kiwi,1582180767,7-month-old baby infected with novel coronavirus discharged from hospital in Jiangxi,https://121private.home.blog/2020/02/20/7-month-old-baby-infected-with-novel-coronavirus-discharged-from-hospital-in-jiangxi/
121kiwi,1582151969,"Factbox: Global efforts to develop vaccines, drugs to fight the coronavirus",https://121private.home.blog/2020/02/19/factbox-global-efforts-to-develop-vaccines-drugs-to-fight-the-coronavirus/
121kiwi,1582173568,Foreign businesses slowly resume operations in China amid coronavirus outbreak,https://121private.home.blog/2020/02/20/foreign-businesses-slowly-resume-operations-in-china-amid-coronavirus-outbreak/
fatouakinajma,1582123295,The Coronavirus Cruise Ship Was a Disease-Spreading Hellscape,https://zoom-viral.com/news/the-coronavirus-cruise-ship-was-a-disease-spreading-hellscape/?feed_id=103572&amp;_unique_id=5e4d491f2a218
neroo-news-en,1582122013,Saudi Arabia health center advises avoiding Singapore for coronavirus risk,https://en.neroonews.com/saudi-arabia-health-center-advises-avoiding-singapore-for-coronavirus-risk/
DaveTamo,1582121288,Coronavirus COVID19 Truth china is hiding from the world,https://www.youtube.com/watch?v=LkpTJXn9_gg&amp;feature=share
121kiwi,1582126748,"75,000 ill, 2,000 deaths, many thousands recovered: Can you get coronavirus twice?",https://121private.home.blog/2020/02/19/75000-ill-2000-deaths-many-thousands-recovered-can-you-get-coronavirus-twice/
cahn10,1582135279,Film Crew Stranded in China Releases Footage of Coronavirus Effects,https://www.indiewire.com/2020/02/film-crew-china-footage-coronavirus-watch-1202212144/
neroo-news-en,1582171287,Two coronavirus Japan cruise ship passengers die due to infection: Media,https://en.neroonews.com/two-coronavirus-japan-cruise-ship-passengers-die-due-to-infection-media/
121kiwi,1582184367,U.S. researchers map 3D structure of novel coronavirus’ key protein,https://121private.home.blog/2020/02/20/u-s-researchers-map-3d-structure-of-novel-coronavirus-key-protein/
121kiwi,1582105171,Coronavirus: How a misleading map went global,https://121private.home.blog/2020/02/19/coronavirus-how-a-misleading-map-went-global-2/
k2yip,1582139313,Sony pulls out of PAX East over coronavirus concerns,https://www.engadget.com/2020/02/19/sony-pax-east-coronavirus-the-last-of-us-part-ii/
121kiwi,1582115946,Novel coronavirus can transmit via aerosol: health authorities,https://121private.home.blog/2020/02/19/novel-coronavirus-can-transmit-via-aerosol-health-authorities/
ScaryChange,1582149739,Asian American teen in L.A. assaulted over coronavirus,https://www.nbcnews.com/news/asian-america/asian-american-teen-l-assaulted-over-coronavirus-n1138376
121kiwi,1582166354,How coronavirus quarantine on cruise ship went so wrong,https://121private.home.blog/2020/02/20/how-coronavirus-quarantine-on-cruise-ship-went-so-wrong/
zinny001,1582155531,#CORONAVIRUS: Tears Flow as Nurses in China are Forced to Shave Hair to fight against the virus as death toll rises to 2000.,https://youtu.be/R7vA1QlNnH0
neroo-news-en,1582122016,Coronavirus vs. Flu Virus: Which Is Deadlier?,https://en.neroonews.com/coronavirus-vs-flu-virus-which-is-deadlier/
Gistmania,1582116078,"Nigerians Attack EFCC Chairman, Ibrahim Magu For Saying Coronavirus Is Caused By Corruption","https://www.gistmania.com/talk/topic,455330.0.html"
fatouakinajma,1582120529,What's Happening With Coronavirus In The UK?,https://zoom-viral.com/news/whats-happening-with-coronavirus-in-the-uk/?feed_id=103502&amp;_unique_id=5e4d3e50ee09a
XVll-L,1582144325,London coronavirus patient turned up at hospital in Uber taxi,https://www.theguardian.com/world/2020/feb/13/london-coronavirus-patient-turned-up-hospital-uber-taxi?CMP=Share_AndroidApp_Post
Alexahadid,1582185206,THIS IS HOW THE DESOLATE STREETS OF CHINA LOOK BECAUSE OF THE QUARANTINE BY THE CORONAVIRUs,https://mrranker.com/this-is-how-the-desolate-streets-of-china-look-because-of-the-quarantine-by-the-coronavirus/
121kiwi,1582177147,2 Passengers on Coronavirus-Stricken Cruise in Japan Have Died,https://121private.home.blog/2020/02/20/2-passengers-on-coronavirus-stricken-cruise-in-japan-have-died/
121kiwi,1582173568,Expert: Novel coronavirus may be as persistent as flu,https://121private.home.blog/2020/02/20/expert-novel-coronavirus-may-be-as-persistent-as-flu/
OldDJ,1582262910,ONE CASE OF COVID-19 (PREVIOUSLY KNOWN AS NOVEL CORONAVIRUS) IN HUMBOLDT COUNTY,http://kymkemp.com/2020/02/20/one-case-of-covid-19-previously-known-as-novel-coronavirus-in-humboldt-county/#comment-973387
KateBanner,1582211716,“Complete chaos”: two passengers aboard the Diamond Princess die from the coronavirus,https://nationoverload.com/complete-chaos-two-passengers-aboard-the-diamond-princess-die-from-the-coronavirus/
121kiwi,1582209560,More coronavirus cases in Iran’s Qom; religious gatherings under threat,https://121private.home.blog/2020/02/20/more-coronavirus-cases-in-irans-qom-religious-gatherings-under-threat/
121kiwi,1582195153,"China’s Hubei, epicentre of coronavirus, extends work suspension to March 11",https://121private.home.blog/2020/02/20/chinas-hubei-epicentre-of-coronavirus-extends-work-suspension-to-march-11/
121kiwi,1582240161,"Chinese FM Tries to Assure Southeast Asians on Coronavirus, Mekong Dams",https://121private.home.blog/2020/02/20/chinese-fm-tries-to-assure-southeast-asians-on-coronavirus-mekong-dams/
121kiwi,1582240154,Problems with CDC coronavirus test delay expanded U.S. screening,https://121private.home.blog/2020/02/20/problems-with-cdc-coronavirus-test-delay-expanded-u-s-screening/
121kiwi,1582213160,First US patient has fully recovered from coronavirus in Washington state; nearly 800 still under watch,https://121private.home.blog/2020/02/20/first-us-patient-has-fully-recovered-from-coronavirus-in-washington-state-nearly-800-still-under-watch/
121kiwi,1582205951,"Poll: Coronavirus fears create travel planning chaos, wreak havoc on international conferences",https://121private.home.blog/2020/02/20/poll-coronavirus-fears-create-travel-planning-chaos-wreak-havoc-on-international-conferences/
freenews24h,1582257557,Un parallèle surprenant a été trouvé entre le coronavirus et la grippe,http://frenews24h.com/un-parallele-surprenant-a-ete-trouve-entre-le-coronavirus-et-la-grippe/
neroo-news-en,1582239698,Kuwait ports authority suspends travel and from Iran due to coronavirus concerns,https://en.neroonews.com/kuwait-ports-authority-suspends-travel-and-from-iran-due-to-coronavirus-concerns/
121kiwi,1582232948,China takes major steps to prop up coronavirus-hit economy,https://121private.home.blog/2020/02/20/china-takes-major-steps-to-prop-up-coronavirus-hit-economy/
howlingmagpie,1582247619,Coronavirus: Ukraine protesters attack buses carrying China evacuees,https://www.bbc.co.uk/news/world-europe-51581805
pleasebekindtopeople,1582248964,Coronavirus-stricken Americans evacuated from a cruise ship flown back to the US on a plane full of healthy people against advice from the CDC.,https://nypost.com/2020/02/20/coronavirus-infected-americans-flown-back-to-us-on-plane-full-of-healthy-people/
121kiwi,1582249155,"Two passengers from coronavirus-hit cruise ship in Japan die, authorities defend quarantine",https://121private.home.blog/2020/02/21/two-passengers-from-coronavirus-hit-cruise-ship-in-japan-die-authorities-defend-quarantine/
121kiwi,1582202364,S. Korea reports first coronavirus death as case number hits 104,https://121private.home.blog/2020/02/20/s-korea-reports-first-coronavirus-death-as-case-number-hits-104/
121kiwi,1582269757,News Daily: Millane killer jailed and coronavirus evacuees attacked,https://121private.home.blog/2020/02/21/news-daily-millane-killer-jailed-and-coronavirus-evacuees-attacked/
121kiwi,1582232952,"Clashes, jeers and burning tires greet coronavirus evacuees in Ukraine",https://121private.home.blog/2020/02/20/clashes-jeers-and-burning-tires-greet-coronavirus-evacuees-in-ukraine/
ChartSearch,1582234572,"Indexes fall, led by tech decline on mounting fears coronavirus could spread",https://www.reuters.com/article/us-usa-stocks/indexes-fall-led-by-tech-decline-on-mounting-fears-coronavirus-could-spread-idUSKBN20E1QD?feedType=RSS&amp;feedName=businessNews
121kiwi,1582240156,PlayStation and Oculus Pull Out of GDC 2020 Due to Coronavirus Concerns,https://121private.home.blog/2020/02/20/playstation-and-oculus-pull-out-of-gdc-2020-due-to-coronavirus-concerns/
hayaimonogachi,1582243869,Americans with coronavirus were flown home over CDC objections,https://thehill.com/policy/healthcare/483925-americans-with-coronavirus-flown-home-over-cdc-objections-report
WikiKnowledge,1582249651,Coronavirus is Spreading Rapidly in China (And One Minority Group Is Under Serious Threat),https://www.wikiknowledge.ml/2020/02/coronavirus-is-spreading-rapidly-in.html
WikiKnowledge,1582249651,Coronavirus updates: 2 passengers die after leaving 'chaotic' cruise ship,https://www.wikiknowledge.ml/2020/02/coronavirus-updates-2-passengers-die.html
121kiwi,1582249166,What’s spreading faster than coronavirus in the US? Racist and ignorant attacks against Asians,https://121private.home.blog/2020/02/21/whats-spreading-faster-than-coronavirus-in-the-us-racist-and-ignorant-attacks-against-asians/
121kiwi,1582236568,"NZers Need To Work Together In Preparation For Likely Coronavirus Pandemic, Otago Expert Says.",https://121private.home.blog/2020/02/20/nzers-need-to-work-together-in-preparation-for-likely-coronavirus-pandemic-otago-expert-says/
