author,created_utc,title,url
HindustanNewsBharat,1581133233,"Coronavirus: China virus death toll rises to 722 with 31,774 cases",https://timesofindia.indiatimes.com/world/china/coronavirus-china-virus-death-toll-rises-to-722-with-31774-cases/articleshow/74019370.cms
121kiwi,1581094408,Pangolins may have spread coronavirus to humans: What we know about the Wuhan virus,https://121private.home.blog/2020/02/07/pangolins-may-have-spread-coronavirus-to-humans-what-we-know-about-the-wuhan-virus/
neroo-news-en,1581094699,World running out of masks against coronavirus: WHO chief,https://en.neroonews.com/world-running-out-of-masks-against-coronavirus-who-chief/
121kiwi,1581098299,The coronavirus is already taking a toll on the luxury industry,https://121private.home.blog/2020/02/07/the-coronavirus-is-already-taking-a-toll-on-the-luxury-industry-2/
121kiwi,1581109175,Police investigate coronavirus racist incidents against Chinese community,https://121private.home.blog/2020/02/07/police-investigate-coronavirus-racist-incidents-against-chinese-community/
meryamsihem,1581109837,"Scientists are in a race against time to develop a vaccine for the Coronavirus, but it could take time",https://sihemsisi2.blogspot.com/2020/02/scientists-are-in-race-against-time-to.
121kiwi,1581119421,Coronavirus: Britons evacuated from Wuhan to be quarantined in Milton Keynes,https://121private.home.blog/2020/02/07/coronavirus-britons-evacuated-from-wuhan-to-be-quarantined-in-milton-keynes/
Tortion,1581123307,Russia spreads news that US behind starting the coronavirus,http://www.bbc.co.uk/news/world-europe-51413870
121kiwi,1581130395,"US will spend $100 million to help China, others fight coronavirus",https://121private.home.blog/2020/02/08/us-will-spend-100-million-to-help-china-others-fight-coronavirus/
fatouakinajma,1581130463,Coronavirus virus latest: China quarantine could create global recession | World | News,https://zoom-viral.com/news/coronavirus-virus-latest-china-quarantine-could-create-global-recession-world-news/?feed_id=82027&amp;_unique_id=5e3e22dee6187
121kiwi,1581080165,Insufficient evidence of mother-to-child coronavirus transmission: expert,https://121private.home.blog/2020/02/07/insufficient-evidence-of-mother-to-child-coronavirus-transmission-expert/
s2nri,1581068961,"Coronavirus: 41 more people, including British honeymooner, test positive on cruise ship – latest news | World news",https://www.theguardian.com/world/live/2020/feb/07/coronavirus-live-updates-in-china-wuhan-coronavirus-outbreak-cruise-ship-doctor-japan
TrixyUkulele,1581075391,Reddit enlists users to combat coronavirus misinformation,https://thehill.com/policy/technology/481956-reddit-enlists-users-to-combat-coronavirus-misinformation
Torixusnews,1581089968,91-Year-Old Coronavirus-infected Patient Cured in Hubei,https://www.torixus.com/2020/02/91-year-old-coronavirus-infected.html
ARVINDBABAJEE,1581062790,https://www.cnbc.com/2020/02/07/coronavirus-latest-updates-china-death-toll-rises.html,https://www.cnbc.com/2020/02/07/coronavirus-latest-updates-china-death-toll-rises.html
neroo-news-en,1581063006,French biotech Novacyt seeks emergency FDA approval for coronavirus test product,https://en.neroonews.com/french-biotech-novacyt-seeks-emergency-fda-approval-for-coronavirus-test-product/
otapp,1581074560,Coronavirus medicine: Indian scientist in Australia brings world closer to a coronavirus vaccine | India News - Times of India,https://timesofindia.indiatimes.com/india/indian-scientist-in-australia-brings-world-closer-to-a-coronavirus-vaccine/articleshow/73996855.cms
sand313man,1581209953,New study an eye-opener on how coronavirus is spreading and how little we know,https://edition.cnn.com/2020/02/08/health/coronavirus-hospital-infections-frieden/index.html
121kiwi,1581166593,Japan ready to mobilize whole country to combat coronavirus with China: ruling camp,https://121private.home.blog/2020/02/08/japan-ready-to-mobilize-whole-country-to-combat-coronavirus-with-china-ruling-camp/
121kiwi,1581173900,Coronavirus: Five Brits in French ski chalet catch virus,https://121private.home.blog/2020/02/08/coronavirus-five-brits-in-french-ski-chalet-catch-virus-3/
121kiwi,1581224355,"Philippines coronavirus patient has recovered, authorities say",https://121private.home.blog/2020/02/09/philippines-coronavirus-patient-has-recovered-authorities-say/
121kiwi,1581213375,Coronavirus global death toll overtakes Sars epidemic,https://121private.home.blog/2020/02/09/coronavirus-global-death-toll-overtakes-sars-epidemic/
121kiwi,1581231035,"Foreign politicians, experts confident about China’s battle against coronavirus outbreak",https://121private.home.blog/2020/02/09/foreign-politicians-experts-confident-about-chinas-battle-against-coronavirus-outbreak/
121kiwi,1581188058,5 quarantined at Travis AFB show symptoms of coronavirus,https://121private.home.blog/2020/02/08/5-quarantined-at-travis-afb-show-symptoms-of-coronavirus/
hereiamredd,1581204078,"Coronavirus Death Toll Rises to 805, Passing SARS: Virus Update",https://apple.news/AKjmHFWDFTjO4VHRKlfGlWA
secwor1d,1581208771,CORONAVIRUS IS NOW AIRBORNE (Verified BBC article was just written in Chinese - copy and paste text into google translate and read.) This is not good at all....,https://www.bbc.com/zhongwen/simp/amp/world-51427216?
121kiwi,1581216790,Factbox: China’s fight against novel coronavirus outbreak,https://121private.home.blog/2020/02/09/factbox-chinas-fight-against-novel-coronavirus-outbreak/
121kiwi,1581216792,"Hubei adds 2,147 new novel coronavirus cases, 81 more fatalities",https://121private.home.blog/2020/02/09/hubei-adds-2147-new-novel-coronavirus-cases-81-more-fatalities/
121kiwi,1581231042,Coronavirus: Final rescue flight from Wuhan due back in UK,https://121private.home.blog/2020/02/09/coronavirus-final-rescue-flight-from-wuhan-due-back-in-uk/
121kiwi,1581224358,Coronavirus prevents Chinese ‘Farewell’ star Zhao Shuzhen from accepting her Spirit Award,https://121private.home.blog/2020/02/09/coronavirus-prevents-chinese-farewell-star-zhao-shuzhen-from-accepting-her-spirit-award/
neroo-news-en,1581235101,Study Abroad Programs On Hold Amid Coronavirus Outbreak,https://en.neroonews.com/study-abroad-programs-on-hold-amid-coronavirus-outbreak/
121kiwi,1581184695,Shanghai rolls out supports for enterprises amid coronavirus epidemic,https://121private.home.blog/2020/02/08/shanghai-rolls-out-supports-for-enterprises-amid-coronavirus-epidemic-3/
tellman1257,1581189937,"LA Tourism: Los Angeles could see a drop of 325,000 Chinese visitors because of the coronavirus outbreak, which would translate into a $921 million hit to the local economy.",https://losangeles.cbslocal.com/2020/02/07/los-angeles-tourism-921-million-hit-coronavirus-outbreak/
VideoCreator02,1581208047,HHS declares coronavirus a public health emergency in the US,https://edition.cnn.com/asia/live-news/coronavirus-outbreak-01-31-20-intl-hnk/h_41287129d996ecb027c4580ef2059409
fatouakinajma,1581193211,Britons on Sunday evacuation flight from coronavirus-hit Wuhan will be held in Milton Keynes,https://zoom-viral.com/news/britons-on-sunday-evacuation-flight-from-coronavirus-hit-wuhan-will-be-held-in-milton-keynes/?feed_id=83359&amp;_unique_id=5e3f17fa0af0b
SourBogBubbleBX3,1581190517,First American dies from coronavirus,https://youtu.be/Oj41SPoT7a8
121kiwi,1581166594,WHO engaging more with private sectors on novel coronavirus medical kit supply,https://121private.home.blog/2020/02/08/who-engaging-more-with-private-sectors-on-novel-coronavirus-medical-kit-supply/
Pufferoon,1581231363,Scientists question work suggesting pangolin coronavirus link - Reuters,https://reut.rs/2SnxKsk
neroo-news-en,1581224289,Philippines evacuates 30 from coronavirus-hit Wuhan,https://en.neroonews.com/philippines-evacuates-30-from-coronavirus-hit-wuhan/
PlumesOfEnceladus,1581167596,Coronavirus fears lead to worldwide mask shortages,https://www.cnn.com/2020/02/07/business/coronavirus-mask-shortage/index.html
neroo-news-en,1581159496,"Five Britons, including child, infected with coronavirus in France",https://en.neroonews.com/five-britons-including-child-infected-with-coronavirus-in-france/
121kiwi,1581155342,U.S. citizen died from coronavirus in China’s Wuhan,https://121private.home.blog/2020/02/08/u-s-citizen-died-from-coronavirus-in-chinas-wuhan/
121kiwi,1581166589,The Coronavirus Outbreak Should Bring Out the Best in Humanity,https://121private.home.blog/2020/02/08/the-coronavirus-outbreak-should-bring-out-the-best-in-humanity/
121kiwi,1581166595,"China has full confidence, capability to win battle against coronavirus outbreak: diplomat",https://121private.home.blog/2020/02/08/china-has-full-confidence-capability-to-win-battle-against-coronavirus-outbreak-diplomat/
121kiwi,1581166594,Novel coronavirus can transmit via aerosol: expert,https://121private.home.blog/2020/02/08/novel-coronavirus-can-transmit-via-aerosol-expert/
neroo-news-en,1581184694,Odion Ighalo misses trip to Spain as Manchester United worry over coronavirus border controls,https://en.neroonews.com/odion-ighalo-misses-trip-to-spain-as-manchester-united-worry-over-coronavirus-border-controls/
fatouakinajma,1581170056,Dr. Marc Siegel: No need to panic about coronavirus in US,https://zoom-viral.com/news/dr-marc-siegel-no-need-to-panic-about-coronavirus-in-us/?feed_id=82893&amp;_unique_id=5e3ebd87072fa
121kiwi,1581231044,Singapore kicks off depleted air show amid coronavirus clampdown,https://121private.home.blog/2020/02/09/singapore-kicks-off-depleted-air-show-amid-coronavirus-clampdown/
121kiwi,1581224347,"China has full confidence, capability to win battle against coronavirus outbreak: diplomat",https://121private.home.blog/2020/02/09/china-has-full-confidence-capability-to-win-battle-against-coronavirus-outbreak-diplomat-2/
121kiwi,1581166590,"Fecal-oral transmission of coronavirus yet to be confirmed, but precautions taken: Chinese expert",https://121private.home.blog/2020/02/08/fecal-oral-transmission-of-coronavirus-yet-to-be-confirmed-but-precautions-taken-chinese-expert/
121kiwi,1581159201,China appreciates UN support in fighting coronavirus: envoy,https://121private.home.blog/2020/02/08/china-appreciates-un-support-in-fighting-coronavirus-envoy/
121kiwi,1581159209,Coronavirus: Five Brits in French ski chalet catch virus,https://121private.home.blog/2020/02/08/coronavirus-five-brits-in-french-ski-chalet-catch-virus-2/
121kiwi,1581162566,What is coronavirus and how worried should we be?,https://121private.home.blog/2020/02/08/what-is-coronavirus-and-how-worried-should-we-be-8/
121kiwi,1581162557,Taiwan confirms 17th case of novel coronavirus infection,https://121private.home.blog/2020/02/08/taiwan-confirms-17th-case-of-novel-coronavirus-infection/
Saint_eX,1581170469,One child among 5 Britons infected with coronavirus in French Alps,http://www.rfi.fr/en/france/20200208-child-among-5-britons-infected-coronavirus-french-alps
121kiwi,1581213384,Chinese takeaway in UK closes down while staff live in coronavirus quarantine,https://121private.home.blog/2020/02/09/chinese-takeaway-in-uk-closes-down-while-staff-live-in-coronavirus-quarantine/
121kiwi,1581213378,"Coronavirus Death Toll Rises to 805, Passing SARS",https://121private.home.blog/2020/02/09/coronavirus-death-toll-rises-to-805-passing-sars-2/
121kiwi,1581205827,"Coronavirus: First pictures of Brit dad and son, 9, ‘infected by guest at same resort’",https://121private.home.blog/2020/02/08/coronavirus-first-pictures-of-brit-dad-and-son-9-infected-by-guest-at-same-resort/
121kiwi,1581180790,‘Contact is limited’: inside the world’s coronavirus quarantines – video,https://121private.home.blog/2020/02/08/contact-is-limited-inside-the-worlds-coronavirus-quarantines-video/
121kiwi,1581180799,Shanghai rolls out supports for enterprises amid coronavirus epidemic,https://121private.home.blog/2020/02/08/shanghai-rolls-out-supports-for-enterprises-amid-coronavirus-epidemic-2/
Calibali445,1581175592,CNN: Schools in California reported officials have confirmed a case of coronavirus within the campus. Check to follow updates:,https://mobile.twitter.com/jose0choa_/status/1225613410202574849
nichdev,1581189703,Facebook Will Ban fallacious Posts On CORONAVIRUS,https://www.htmlhints.com/article/65/facebook-will-ban-fallacious-posts-on-coronavirus
fatouakinajma,1581194123,Coronavirus latest: Plane carrying 200 Britons headed to UK from China | UK | News,https://zoom-viral.com/news/coronavirus-latest-plane-carrying-200-britons-headed-to-uk-from-china-uk-news/?feed_id=83375&amp;_unique_id=5e3f1b8b0950a
bietcoin,1581204656,🔴 [LIVE] Coronavirus Live Map and Breaking News 2019-nCoV - Predictions every 15 mins!,https://www.youtube.com/watch?v=HgOg6C48qOM
Deatheater420,1581218028,"RIP to DR. Li Wenliang, the Chinese doctor who sounded the alarm on the Wuhan Coronavirus back in December, he silenced by the police after warning about the new Coronavirus that has killed hundreds.",https://www.nytimes.com/2020/02/07/business/china-coronavirus-doctor-death.html
121kiwi,1581216784,"Coronavirus death toll surpasses SARS, with 811 confirmed fatalities",https://121private.home.blog/2020/02/09/coronavirus-death-toll-surpasses-sars-with-811-confirmed-fatalities/
121kiwi,1581151870,Coronavirus: two deaths in Wuhan thought to be first of foreign nationals,https://121private.home.blog/2020/02/08/coronavirus-two-deaths-in-wuhan-thought-to-be-first-of-foreign-nationals/
hoosakiwi,1581296624,Coronavirus Megathread #3,https://www.reddit.com/r/news/comments/f1ih07/coronavirus_megathread_3/
121kiwi,1581275611,"‘Hundreds of people’ at ski resort tested for Coronavirus after Brit child, 9, diagnosed",https://121private.home.blog/2020/02/09/hundreds-of-people-at-ski-resort-tested-for-coronavirus-after-brit-child-9-diagnosed/
Lostrealitives,1581301798,"Bill Gates help fund an event LAST YEAR called “Novel Coronavirus Pandemic Preparedness Exercise” October 18, in New York?!",https://www.investmentwatchblog.com/bill-gates-help-fund-an-event-last-year-called-novel-coronavirus-pandemic-preparedness-exercise-october-18-in-new-york/
121kiwi,1581302590,Coronavirus quarantine in Wuhan: Finding all potential infections,https://121private.home.blog/2020/02/10/coronavirus-quarantine-in-wuhan-finding-all-potential-infections/
121kiwi,1581308002,Coronavirus: WHO warns transmission by people who had not visited China could be ‘tip of the iceberg’,https://121private.home.blog/2020/02/10/coronavirus-who-warns-transmission-by-people-who-had-not-visited-china-could-be-tip-of-the-iceberg/
121kiwi,1581311600,Ambulance driver in battle against coronavirus in Hangzhou,https://121private.home.blog/2020/02/10/ambulance-driver-in-battle-against-coronavirus-in-hangzhou/
WikiKnowledge,1581310050,"2 cruise ships have been quarantined over the coronavirus: 1 released its passengers, the other is seeing more people get sick",https://www.wikiknowledge.ml/2020/02/2-cruise-ships-have-been-quarantined.html
GeekygamerPro,1581296663,PM Modi offers India’s help to China in its fight against coronavirus | OnlyScoop,https://onlyscoop.com/news/pm-modi-offers-india-s-help-to-china-in-its-fight-against-coronavirus-224
HindustanNewsBharat,1581295234,"Coronavirus: All aboard luxury cruise liner off Hong Kong test negative, allowed to leave",https://timesofindia.indiatimes.com/world/china/coronavirus-all-aboard-luxury-cruise-liner-off-hong-kong-test-negative-allowed-to-leave/articleshow/74053244.cms
Weider2,1581309121,"Benue: Killer disease a mystery, it's not Ebola, Lassa Fever or Coronavirus - Nigerian govt - Daily Post Nigeria",https://dailypost.ng/2020/02/07/benue-killer-disease-a-mystery-its-not-ebola-lassa-fever-or-coronavirus-nigerian-govt/
WikiKnowledge,1581299249,Four cruise passengers test negative for coronavirus on ship in New Jersey,https://www.wikiknowledge.ml/2020/02/four-cruise-passengers-test-negative.html
121kiwi,1581318797,Coronavirus: Australians stranded in Wuhan fear they have been ‘swept under the carpet’,https://121private.home.blog/2020/02/10/coronavirus-australians-stranded-in-wuhan-fear-they-have-been-swept-under-the-carpet/
xryanpagex,1581319537,UK declares coronavirus a 'serious and imminent threat' to public health,https://www.theguardian.com/world/live/2020/feb/10/coronavirus-live-updates-china-goes-back-to-work-as-cases-exceed-40000-latest-news?CMP=Share_iOSApp_Other
freenews24h,1581315975,Chef de l’OMS: la lutte contre le coronavirus déjoue les théories du complot et les trolls,http://frenews24h.com/chef-de-loms-la-lutte-contre-le-coronavirus-dejoue-les-theories-du-complot-et-les-trolls/
Elfins,1581238973,"Actor Jackie Chan promises to pay $140,000 for coronavirus vaccine",https://nation.com.pk/09-Feb-2020/actor-jackie-chan-promises-to-pay-dollar-140-000-for-coronavirus-vaccine
freenews24h,1581236227,Impact du coronavirus sur le plan de relance économique – Guan Eng | National,http://frenews24h.com/impact-du-coronavirus-sur-le-plan-de-relance-economique-guan-eng-national/
AntisocialFetus,1581259871,"14 more Americans with coronavirus, from the japanese cruise ship",https://www.nbcnews.com/news/world/new-coronavirus-updates-number-confirmed-cases-drops-disease-s-epicenter-n1133141
neroo-news-en,1581292710,China returns to work as coronavirus deaths tops SARS toll,https://en.neroonews.com/china-returns-to-work-as-coronavirus-deaths-tops-sars-toll/
idaell,1581288299,Five ways coronavirus could hurt Trump's economy -- and one way it might help,https://www.cnn.com/2020/02/09/politics/coronavirus-us-economy-risks/index.html
121kiwi,1581286408,Coronavirus: Brit ‘refused’ from China rescue flight after coats made temperature spike,https://121private.home.blog/2020/02/09/coronavirus-brit-refused-from-china-rescue-flight-after-coats-made-temperature-spike/
neroo-news-en,1581321494,"Coronavirus Global Deaths Soars To Alarming Rate, Surpasses SARS",https://en.neroonews.com/coronavirus-global-deaths-soars-to-alarming-rate-surpasses-sars/
121kiwi,1581318796,"News Daily: Storm Ciara, Oscars 2020 and coronavirus latest",https://121private.home.blog/2020/02/10/news-daily-storm-ciara-oscars-2020-and-coronavirus-latest/
121kiwi,1581318806,Analysis: China’s massive security state is being used to crack down on coronavirus,https://121private.home.blog/2020/02/10/analysis-chinas-massive-security-state-is-being-used-to-crack-down-on-coronavirus/
121kiwi,1581236012,Coronavirus evacuation flight carrying more Brits from Wuhan lands at RAF base,https://121private.home.blog/2020/02/09/coronavirus-evacuation-flight-carrying-more-brits-from-wuhan-lands-at-raf-base/
121kiwi,1581236007,China to stagger back to work as coronavirus deaths surpass SARS,https://121private.home.blog/2020/02/09/china-to-stagger-back-to-work-as-coronavirus-deaths-surpass-sars/
neroo-news-en,1581263896,Woman infected with coronavirus cured: UAE,https://en.neroonews.com/woman-infected-with-coronavirus-cured-uae/
Lostrealitives,1581301754,"Bill Gates help fund an event LAST YEAR called “Novel Coronavirus Pandemic Preparedness Exercise” October 18, in New York?!",https://www.investmentwatchblog.com/bill-gates-help-fund-an-event-last-year-called-novel-coronavirus-pandemic-preparedness-exercise-october-18-in-new-york/
121kiwi,1581282815,Amazon pulls out of major Barcelona telecoms conference over coronavirus,https://121private.home.blog/2020/02/09/amazon-pulls-out-of-major-barcelona-telecoms-conference-over-coronavirus/
121kiwi,1581299004,"Coronavirus live updates: China goes back to work as cases exceed 40,000 – latest news",https://121private.home.blog/2020/02/10/coronavirus-live-updates-china-goes-back-to-work-as-cases-exceed-40000-latest-news/
121kiwi,1581315209,Australian scientists make coronavirus breakthrough with live strain,https://121private.home.blog/2020/02/10/australian-scientists-make-coronavirus-breakthrough-with-live-strain/
Lostrealitives,1581302571,"Bill Gates help fund an event LAST YEAR called “Novel Coronavirus Pandemic Preparedness Exercise” October 18, in New York?! Will not let me post a link just Google it.",https://www.investmentwatchblog.com/bill-gates-help-fund-an-event-last-year-called-novel-coronavirus-pandemic-preparedness-exercise-october-18-in-new-york/
Gistmania,1581238513,"Deaths In China From Coronavirus Reach 811, Surpassing Death Toll From SARS Epidemic","https://www.gistmania.com/talk/topic,454013.0.html"
121kiwi,1581239597,Daily novel coronavirus pneumonia cases further drop outside epicenter province,https://121private.home.blog/2020/02/09/daily-novel-coronavirus-pneumonia-cases-further-drop-outside-epicenter-province/
121kiwi,1581243208,Coronavirus: Brit dad in Majorca tests positive for bug as wife and kids cleared,https://121private.home.blog/2020/02/09/coronavirus-brit-dad-in-majorca-tests-positive-for-bug-as-wife-and-kids-cleared/
121kiwi,1581243206,Six new cases of coronavirus on cruise ship quarantined off Japan,https://121private.home.blog/2020/02/09/six-new-cases-of-coronavirus-on-cruise-ship-quarantined-off-japan/
neroo-news-en,1581249503,Thousands at risk of coronavirus on cruise ship as more infected,https://en.neroonews.com/thousands-at-risk-of-coronavirus-on-cruise-ship-as-more-infected/
121kiwi,1581250415,Fourth person in UK has coronavirus after catching deadly bug in France,https://121private.home.blog/2020/02/09/fourth-person-in-uk-has-coronavirus-after-catching-deadly-bug-in-france/
fatouakinajma,1581245177,Newt Gingrich: Coronavirus is a reminder to stay ahead of pandemics,https://zoom-viral.com/news/newt-gingrich-coronavirus-is-a-reminder-to-stay-ahead-of-pandemics/?feed_id=84395&amp;_unique_id=5e3fe2f941c85
121kiwi,1581302591,Xenophobia harms global fight against coronavirus: Chinese ambassador to U.S.,https://121private.home.blog/2020/02/10/xenophobia-harms-global-fight-against-coronavirus-chinese-ambassador-to-u-s/
121kiwi,1581298998,"Chinese hospitals discharge 3,281 recovered patients of coronavirus infection",https://121private.home.blog/2020/02/10/chinese-hospitals-discharge-3281-recovered-patients-of-coronavirus-infection/
121kiwi,1581268414,The coronavirus crisis could shut auto plants around the world,https://121private.home.blog/2020/02/09/the-coronavirus-crisis-could-shut-auto-plants-around-the-world/
drunk69,1581270474,Coronavirus deaths surpass SARS,https://www.silive.com/news/2020/02/report-coronavirus-deaths-surpass-sars.html
121kiwi,1581257590,Five ways coronavirus could hurt Trump’s economy — and one way it might help,https://121private.home.blog/2020/02/09/five-ways-coronavirus-could-hurt-trumps-economy-and-one-way-it-might-help/
WA2099,1581298336,China braces for return to work as coronavirus deaths exceed Sars | World news,https://www.theguardian.com/world/2020/feb/09/coronavirus-global-death-toll-overtakes-sars-epidemic
magicmonkeyjunk,1581313748,Coronavirus way worse than MSM saying,https://www.ccn.com/billionaire-whistleblower-wuhan-coronavirus-death-toll-is-over-50000/
neroo-news-en,1581314312,"Can Lysol Sprays, Clorox Wipes Help Combat Coronavirus Outbreak?",https://en.neroonews.com/can-lysol-sprays-clorox-wipes-help-combat-coronavirus-outbreak/
coolcarve,1581298150,Coronavirus Megathread #3,https://www.reddit.com/r/news/comments/f1ih07/coronavirus_megathread_3/
goodthingshappening,1581277078,Washington doctor's successfully treat coronavirus,https://www.thegatewaypundit.com/2020/02/breaking-washington-doctors-successfully-treat-coronavirus-patient-with-experimental-anti-viral-medication-significantly-improved-in-hours-video/
mylesrev1,1581241379,"Coronavirus, forced quarantines, sick citizens refuse to be brought to q...",https://www.youtube.com/watch?v=_i0Uovq0T4k&amp;feature=share
121kiwi,1581246788,Coronavirus latest: Briton tests positive for deadly virus as Spain confirms second case,https://121private.home.blog/2020/02/09/coronavirus-latest-briton-tests-positive-for-deadly-virus-as-spain-confirms-second-case/
fatouakinajma,1581322469,Hundreds of people are tested for coronavirus in the French Alps,https://zoom-viral.com/news/hundreds-of-people-are-tested-for-coronavirus-in-the-french-alps/?feed_id=86018&amp;_unique_id=5e4110e59641e
d8sconz,1581328833,Coronavirus: journalist missing in Wuhan as anger towards Chinese authorities grows,https://www.theguardian.com/world/2020/feb/10/coronavirus-journalist-missing-in-wuhan-as-anger-towards-chinese-authorities-grows
121kiwi,1581358419,Coronavirus ‘can survive on surfaces such as door handles and bus poles for 9 days’,https://121private.home.blog/2020/02/10/coronavirus-can-survive-on-surfaces-such-as-door-handles-and-bus-poles-for-9-days/
SeniorWave,1581359792,An American coronavirus quarantine would look less like the movies and more like watching movies on Netflix,https://www.cleveland.com/news/2020/02/an-american-coronavirus-quarantine-would-look-less-like-the-movies-and-more-like-watching-movies-on-netflix.html
bietcoin,1581361645,🔴 [LIVE] Coronavirus Live Map and Breaking News 2019-nCoV - Predictions every 15 mins!,https://youtube.com/watch?v=HgOg6C48qOM
121kiwi,1581365595,Yoga class ‘at risk of coronavirus’ amid fears ‘super spreader’ attended,https://121private.home.blog/2020/02/10/yoga-class-at-risk-of-coronavirus-amid-fears-super-spreader-attended/
freenews24h,1581342430,Coronavirus: les spectateurs de Jeonbuk Motors-Yokohama FM devront porter un masque,http://frenews24h.com/coronavirus-les-spectateurs-de-jeonbuk-motors-yokohama-fm-devront-porter-un-masque/
neroo-news-en,1581332310,Number of coronavirus infections doubles in England,https://en.neroonews.com/number-of-coronavirus-infections-doubles-in-england/
121kiwi,1581336814,China’s Xi says to prevent large-scale layoffs amid coronavirus outbreak,https://121private.home.blog/2020/02/10/chinas-xi-says-to-prevent-large-scale-layoffs-amid-coronavirus-outbreak/
