author,created_utc,title,url
_Gus,1580439281,No te dejes engañar por estas noticias falsas del coronavirus,https://cnnespanol.cnn.com/video/fake-news-coronavirus-noticias-falsas-rumores-cerveza-pkg-seg-michael-roa/
kortizoll,1580442467,WHO declares Coronavirus as a Global Health Emergency,https://youtu.be/NeDeOxb4ofg
121kiwi,1580442609,NGO Concerned Poor Would Suffer Most if Coronavirus Spreads to North Korea,https://121private.home.blog/2020/01/31/ngo-concerned-poor-would-suffer-most-if-coronavirus-spreads-to-north-korea/
sannalav99,1580451258,India to test all travellers from China since January 15 for CoronaVirus,https://newsmeter.in/all-travellers-from-china-since-15-january-2020-shall-be-tested-for-coronavirus/
Alaskan_Lost,1580407769,"Person-to-person transmission of coronavirus reported in US, CDC says",https://www.foxnews.com/health/person-to-person-transmission-coronavirus-reported-in-us-cdc
LowPersonality7,1580410472,News 101k shares China's richest man Jack Ma donates £11million to help scientists develop coronavirus vaccine,https://www.dailymail.co.uk/news/article-7943737/Chinas-richest-man-Jack-Ma-donates-11million-help-scientists-develop-coronavirus-vaccine.html
That-Shit-will-buff-,1580407437,"7,000 people held on cruise ship after passenger develops suspected coronavirus symptoms",https://www.foxnews.com/travel/7000-people-held-cruise-ship-coronavirus-passenger-suspected-symptoms-report
fatouakinajma,1580416877,Coronavirus warning: UK threat increases as chief medical officers urge Government action | UK | News,https://zoom-viral.com/news/coronavirus-warning-uk-threat-increases-as-chief-medical-officers-urge-government-action-uk-news/?feed_id=65588&amp;_unique_id=5e333f6d0b93f
TECHiNFONICS,1580417356,CDC confirms first human-to-human transmission of coronavirus in US,http://techinfonics.com/cdc-confirms-first-human-to-human-transmission-of-coronavirus-in-us/2997/2020/
DragneeI,1580414918,Coronavirus declared global health emergency,https://www.bbc.com/news/world-51318246
Kuominwave,1580417540,2nd confirmed case of coronavirus in Illinois,https://www.kwqc.com/content/news/2nd-confirmed-case-of-coronavirus-in-Illinois-567432441.html
Harvard2TheBigHouse,1580409128,CDC confirms first human-to-human transmission of coronavirus in US,https://www.cnbc.com/2020/01/30/cdc-confirms-first-human-to-human-transmission-of-coronavirus-in-us.html
Consiliarius,1580413588,Coronavirus declared global health emergency,https://www.bbc.co.uk/news/world-51318246
johngamer123,1580413385,Reason of Coronavirus in china | MUST WATCH |,https://www.youtube.com/watch?v=dGCE1csKuWc&amp;feature=share
neroo-news-en,1580413418,"Coronavirus patient cured in Guizhou, says official Chinese media",https://en.neroonews.com/coronavirus-patient-cured-in-guizhou-says-official-chinese-media/
abazazeoee,1580413641,Coronavirus declared global health emergency,https://www.bbc.com/news/world-51318246?ns_mchannel=social&amp;ns_campaign=bbc_breaking&amp;ns_linkname=news_central&amp;ns_source=twitter
PjotrSauer,1580475984,Russia Reports First Coronavirus Cases - The Moscow Times,https://www.themoscowtimes.com/2020/01/31/russia-reports-first-coronavirus-cases-a69123
inexplorata,1580504594,US declares public health emergency over coronavirus,https://thehill.com/policy/healthcare/480938-us-declares-public-health-emergency-over-coronavirus
thejacl,1580469118,Coronavirus suspected in Estonia,https://m.delfi.ee/eesti/article.php?id=88808713
121kiwi,1580509763,U.S. Declares Public Health Emergency Over Coronavirus and Will Deny Entry to Foreign Nationals Who Have Been in China,https://121private.home.blog/2020/01/31/u-s-declares-public-health-emergency-over-coronavirus-and-will-deny-entry-to-foreign-nationals-who-have-been-in-china/
Jack6535511,1580511253,Coronavirus task force another example of Trump administration's lack of diversity,https://www.cnn.com/2020/01/30/politics/donald-trump-coronavirus-diversity-obama/index.html
121kiwi,1580500759,Coronavirus: British mum and son back safely from Wuhan,https://121private.home.blog/2020/01/31/coronavirus-british-mum-and-son-back-safely-from-wuhan/
polandballbounces,1580503466,How to Prepare for a Coronavirus Pandemic,https://www.foreignaffairs.com/articles/china/2020-01-31/how-prepare-coronavirus-pandemic
where_do_i_charge_up,1580504596,CDC orders a 14-day coronavirus quarantine for 195 Americans evacuated from Wuhan,https://www.cnn.com/2020/01/31/health/us-coronavirus-friday/index.html
121kiwi,1580513354,Coronavirus: US bars foreign nationals who have recently travelled to China,https://121private.home.blog/2020/01/31/coronavirus-us-bars-foreign-nationals-who-have-recently-travelled-to-china/
121kiwi,1580522344,"China reports 46 new coronavirus deaths, total at 259",https://121private.home.blog/2020/02/01/china-reports-46-new-coronavirus-deaths-total-at-259/
121kiwi,1580522349,Biden slams Trump for cutting health programs before coronavirus outbreak,https://121private.home.blog/2020/02/01/biden-slams-trump-for-cutting-health-programs-before-coronavirus-outbreak-2/
pineblossom89,1580459221,Pilots and flight attendants plead with airlines to stop flights bound for China as the coronavirus spreads; American Airline pilots file lawsuit,https://www.reuters.com/article/us-china-health-airlines/pilots-flight-attendants-demand-flights-to-china-stop-as-virus-fear-mounts-worldwide-idUSKBN1ZT33W
neroo-news-en,1580463806,18 S.Koreans showing coronavirus symptoms after leaving China,https://en.neroonews.com/18-s-koreans-showing-coronavirus-symptoms-after-leaving-china/
gtrooperz,1580464304,Coronavirus declared global health emergency by WHO,https://www.google.co.uk/amp/s/www.bbc.co.uk/news/amp/world-51318246
CJBill,1580464425,Two people in Britain test positive for coronavirus,https://www.theguardian.com/world/2020/jan/31/two-people-in-britain-test-positive-for-coronavirus
PochinFc15,1580464592,First coronavirus cases confirmed in UK,https://www.google.ca/amp/s/www.telegraph.co.uk/news/2020/01/31/two-people-england-have-testedpositive-coronavirus/amp/
Gistmania,1580465592,UK Records Two Positive Cases For Coronavirus,"https://www.gistmania.com/talk/topic,452497.0.html"
anjaliarora77,1580488686,India on High alert after getting for a confirmed case of Coronavirus. - BlogOnBox- Latest Current Affairs | Trending Blogs | Latest Updates,https://blogonbox.com/india-on-high-alert-after-getting-for-a-confirmed-case-of-coronavirus/
121kiwi,1580489974,Coronavirus UK: Brit bus driver completely unfazed next to man in full hazmat suit,https://121private.home.blog/2020/01/31/coronavirus-uk-brit-bus-driver-completely-unfazed-next-to-man-in-full-hazmat-suit/
Frocharocha,1580481153,"China Implements Temporary Wild Animal Trade Ban Due To Coronavirus, Activists Push To Make It Permanent",https://www.greenqueen.com.hk/china-wild-animal-trade-ban-temporary-coronavirus-activists-want-permanent/
mutuleel,1580484009,Sweden confirms first case of coronavirus in Jönköping,https://twitter.com/sr_ekot/status/1223260290889998336?s=20
ClownsToTheRightOfMe,1580494110,America’s Coronavirus: Containing the Outbreak of Trumpism,https://www.fairobserver.com/politics/coronavirus-outbreak-trumpism-us-politics-news-14431/
thetopviralvideos,1580492842,The coronavirus outbreak is a global health emergency,https://haitianhollywood.com/world-news/10322-the-coronavirus-outbreak-is-a-global-health-emergency.html#.XjRoHkgcr98.reddit
121kiwi,1580475545,Why Coronavirus Seems to Be Striking More Adults Than Kids,https://121private.home.blog/2020/01/31/why-coronavirus-seems-to-be-striking-more-adults-than-kids/
Frocharocha,1580475410,Coronavirus declared global health emergency by WHO,https://www.bbc.com/news/world-51318246
neroo-news-en,1580471010,WHO says countries should keep borders open despite coronavirus,https://en.neroonews.com/who-says-countries-should-keep-borders-open-despite-coronavirus/
neroo-news-en,1580470996,German military plane sent to evacuate citizens from China amid coronavirus,https://en.neroonews.com/german-military-plane-sent-to-evacuate-citizens-from-china-amid-coronavirus/
Tosinpeter,1580471127,WHO Declares International Emergency On Coronavirus,https://www.flameloaded.com.ng/2020/01/who-declares-international-emergency-on.html
zerriqyounass,1580469103,"two confirmed coronavirus cases in England, says chief medical officer",https://www.guardienmag.com/2020/01/two-confirmed-coronavirus-cases-in.html
UteForLife,1580506940,"Trump imposes travel restrictions, mandatory quarantines over coronavirus outbreak",https://www.cnbc.com/2020/01/31/white-house-to-hold-briefing-on-coronavirus-friday-afternoon.html
ToasterFromEbay,1580506341,More people have now recovered from then died from the novel coronavirus for the first time since the very early stages of the outbreak.,https://gisanddata.maps.arcgis.com/apps/opsdashboard/index.html#/bda7594740fd40299423467b48e9ecf6
fatouakinajma,1580506456,Coronavirus Has Led to a Surge in Popularity for the 2011 Movie 'Contagion',https://zoom-viral.com/news/coronavirus-has-led-to-a-surge-in-popularity-for-the-2011-movie-contagion/?feed_id=67702&amp;_unique_id=5e349d55bf2f4
Gistmania,1580505204,Nigeria Among High-Risk African Nations For Coronavirus - WHO Reveals,"https://www.gistmania.com/talk/topic,452547.0.html"
drunk69,1580506101,U.S. declares coronavirus a public health emergency,https://www.reuters.com/article/us-china-health-usa-cdc/u-s-declares-coronavirus-a-public-health-emergency-idUSKBN1ZU2XV?il=0
Jmdlh123,1580509316,Coronavirus evacuations: CDC orders 14-day federal quarantine for Americans flown to California,https://www.nbcnews.com/health/health-news/cdc-orders-14-day-federal-quarantine-americans-flown-california-n1127551
121kiwi,1580540363,Integrative field test machine for coronavirus ready for clinical testing,https://121private.home.blog/2020/02/01/integrative-field-test-machine-for-coronavirus-ready-for-clinical-testing/
danielgabaylo,1580538921,Singapore FAQ: Wuhan coronavirus and its outbreak,https://www.channelnewsasia.com/news/singapore/faq-wuhan-coronavirus-and-its-outbreak-12373466
istrng,1580526136,Treatment - Novel Coronavirus in the United States | NEJM,https://www.nejm.org/doi/full/10.1056/NEJMoa2001191
121kiwi,1580525955,103 novel coronavirus-infected patients cured in Wuhan,https://121private.home.blog/2020/02/01/103-novel-coronavirus-infected-patients-cured-in-wuhan/
fatouakinajma,1580523966,Inside the UK Coronavirus quarantine centre on the Wirral,https://zoom-viral.com/news/inside-the-uk-coronavirus-quarantine-centre-on-the-wirral/?feed_id=68124&amp;_unique_id=5e34e1bdc3d3c
121kiwi,1580543967,Global health Emergency declared over Coronavirus by WHO,https://121private.home.blog/2020/02/01/global-health-emergency-declared-over-coronavirus-by-who/
121kiwi,1580497157,Coronavirus outbreak: What travelers need to know,https://121private.home.blog/2020/01/31/coronavirus-outbreak-what-travelers-need-to-know-2/
nicehatmrdog,1580498356,First Coronavirus outbreak in the UK,https://www.thesun.co.uk/news/10860963/coronavirus-uk-york-staycity-newcastle-wuhan-china/
shill_hunter_x,1580474434,Two people in Britain test positive for coronavirus,https://www.theguardian.com/world/2020/jan/31/two-people-in-britain-test-positive-for-coronavirus
121kiwi,1580468359,Facebook takes steps to combat online misinformation about novel coronavirus,https://121private.home.blog/2020/01/31/facebook-takes-steps-to-combat-online-misinformation-about-novel-coronavirus/
Philipp_Dase,1580463249,First two cases of Coronavirus confirmed in the UK,https://www.bbc.co.uk/news/health-51325192
fatouakinajma,1580463388,Coronavirus: Two cases of deadly virus confirmed in England – Chief Medical Officer | UK | News,https://zoom-viral.com/news/coronavirus-two-cases-of-deadly-virus-confirmed-in-england-chief-medical-officer-uk-news/?feed_id=66693&amp;_unique_id=5e33f51b70769
robotsdeforex00001,1580483645,⚠️ Novel Coronavirus Prevention and Treatment ⛔ How to Prevent Coronavir...,https://www.youtube.com/watch?v=DB0KatlTZWc&amp;feature=share
neroo-news-en,1580485397,Global Airlines continue to suspend flights to China due to coronavirus,https://en.neroonews.com/global-airlines-continue-to-suspend-flights-to-china-due-to-coronavirus/
xPerpendicular,1580494421,Latest WHO announcement on coronavirus!,https://www.ng-news.net/coronavirus-reached-india-russia-and-britain-who-to-announce-global-health-emergency/
duderos,1580594021,U.S. confirms its 8th case of coronavirus; Pentagon to provide quarantine housing,https://www.reuters.com/article/us-china-health-usa/u-s-confirms-its-8th-case-of-coronavirus-pentagon-to-provide-quarantine-housing-idUSKBN1ZV3XV
Rbkelley1,1580621587,"Official Coronavirus update from Beijing: 14,380 cases, 304 deaths",https://www.cnbc.com/2020/02/02/coronavirus-latest-updates-china-hubei-cases-and-deaths.html
121kiwi,1580630352,Coronavirus: First death outside China as man dies from disease in Philippines,https://121private.home.blog/2020/02/02/coronavirus-first-death-outside-china-as-man-dies-from-disease-in-philippines/
121kiwi,1580583547,Coronavirus deaths hit 259 as China voices anger at US travel ban,https://121private.home.blog/2020/02/01/coronavirus-deaths-hit-259-as-china-voices-anger-at-us-travel-ban/
TigerLilly00,1580591062,Eighth US coronavirus case confirmed in Boston,https://www.cnn.com/2020/02/01/us/coronavirus-us-massachusetts/index.html
121kiwi,1580619562,Philippines coronavirus death is first fatality outside China,https://121private.home.blog/2020/02/02/philippines-coronavirus-death-is-first-fatality-outside-china/
121kiwi,1580619556,Confirmed cases of novel coronavirus infection increase to 14 in Hong Kong,https://121private.home.blog/2020/02/02/confirmed-cases-of-novel-coronavirus-infection-increase-to-14-in-hong-kong/
121kiwi,1580615954,Cremate coronavirus dead nearby: National Health Commission,https://121private.home.blog/2020/02/02/cremate-coronavirus-dead-nearby-national-health-commission/
121kiwi,1580554755,‘She’s a TIMEBOMB’ Chinese woman hides Coronavirus to enter France – and brags online,https://121private.home.blog/2020/02/01/shes-a-timebomb-chinese-woman-hides-coronavirus-to-enter-france-and-brags-online-2/
KingKilljaden,1580560097,"Online Timeline Coronavirus map and data(All data were taken from official sources, with links to them.)",https://www.hypergdev.xyz/coronavirus
121kiwi,1580547557,Beijing gives updated coronavirus numbers,https://121private.home.blog/2020/02/01/beijing-gives-updated-coronavirus-numbers/
cornbeefandhash,1580558093,"Can anyone corroborate this article: Coronavirus Contains ""HIV Insertions"", Stoking Fears Over Artificially Created Bioweapon.",https://www.zerohedge.com/geopolitical/coronavirus-contains-hiv-insertions-stoking-fears-over-artificially-created-bioweapon
robotsdeforex00001,1580565410,🔶 What to do if You Are Sick with 2019 NOVEL CORONAVIRUS❓,https://www.youtube.com/watch?v=RE174F93IEY&amp;feature=share
121kiwi,1580605143,U.S. confirms its eighth case of coronavirus; Pentagon to provide quarantine housing,https://121private.home.blog/2020/02/02/u-s-confirms-its-eighth-case-of-coronavirus-pentagon-to-provide-quarantine-housing/
121kiwi,1580551158,Coronavirus: British man’s ‘frantic’ escape from epicentre with Chinese wife,https://121private.home.blog/2020/02/01/coronavirus-british-mans-frantic-escape-from-epicentre-with-chinese-wife/
121kiwi,1580619557,Philippines reports 1st death from novel coronavirus,https://121private.home.blog/2020/02/02/philippines-reports-1st-death-from-novel-coronavirus/
opie211,1580613808,Is This The Man Behind The Global Coronavirus Pandemic?,https://www.zerohedge.com/health/man-behind-global-coronavirus-pandemic
fatouakinajma,1580620489,Coronavirus death in Philippines said to be first outside China,https://zoom-viral.com/news/coronavirus-death-in-philippines-said-to-be-first-outside-china/?feed_id=70923&amp;_unique_id=5e365ac90d9ef
121kiwi,1580592552,Two coronavirus cases confirmed in South Australia,https://121private.home.blog/2020/02/01/two-coronavirus-cases-confirmed-in-south-australia/
121kiwi,1580594353,Xenophobia ‘Is A Pre-Existing Condition.’ How Harmful Stereotypes and Racism are Spreading Around the Coronavirus,https://121private.home.blog/2020/02/01/xenophobia-is-a-pre-existing-condition-how-harmful-stereotypes-and-racism-are-spreading-around-the-coronavirus/
121kiwi,1580612366,Chinese medical worker who fought Ebola joins coronavirus battle in Wuhan,https://121private.home.blog/2020/02/02/chinese-medical-worker-who-fought-ebola-joins-coronavirus-battle-in-wuhan/
Gistmania,1580604197,Coronavirus: 5 Abuja Residents Arrested By Police Over False Claim Of Contracting The Disease,"https://www.gistmania.com/talk/topic,452665.0.html"
llodeguzman,1580590124,The Cure of Coronavirus,https://youtu.be/jgG5EcJ2iLY
slowdefensive,1580595056,"First case of coronavirus confirmed in Massachusetts, USA",https://www.boston.com/news/health/2020/02/01/first-case-of-coronavirus-confirmed-in-massachusetts
Racing_in_the_street,1580588001,8th U.S case of coronavirus confirmed.,https://www.cbsnews.com/live-updates/coronavirus-usa-news-public-health-emergency-death-toll-2020-02-01/
Bennypc,1580615125,First Coronavirus death outside of China,https://edition.cnn.com/asia/live-news/coronavirus-outbreak-02-02-20-intl-hnk/h_8834bc8f3c722824cc7fe6ebe00160ff
wgb241988,1580616389,First death from coronavirus outside China,https://www.bbc.co.uk/news/world-asia-51345855
121kiwi,1580619554,Chinese hospitals discharge 328 recovered patients of coronavirus infection,https://121private.home.blog/2020/02/02/chinese-hospitals-discharge-328-recovered-patients-of-coronavirus-infection-2/
121kiwi,1580619558,Workers make protective suits to help combat novel coronavirus,https://121private.home.blog/2020/02/02/workers-make-protective-suits-to-help-combat-novel-coronavirus/
neroo-news-en,1580550187,Australia to refuse entry to non-citizens arriving from China due to coronavirus,https://en.neroonews.com/australia-to-refuse-entry-to-non-citizens-arriving-from-china-due-to-coronavirus/
121kiwi,1580554757,Coronavirus scare at London Paddington station as masked workers surround woman,https://121private.home.blog/2020/02/01/coronavirus-scare-at-london-paddington-station-as-masked-workers-surround-woman/
neroo-news-en,1580546598,China flies citizens home to coronavirus-hit Wuhan,https://en.neroonews.com/china-flies-citizens-home-to-coronavirus-hit-wuhan/
avivi_,1580550351,"Washington state coronavirus patient treated with investigational, unapproved Ebola drug",https://www.spokesman.com/stories/2020/jan/31/washington-state-coronavirus-patient-treated-with-/
Tosinpeter,1580557536,Coronavirus: China Orders Citizens To Get Rid Of Pets,https://www.flameloaded.com.ng/2020/02/coronavirus-china-orders-citizens-to.html
fatouakinajma,1580559403,Chinatown to ghost town: London's famous district is deserted as coronavirus fear spreads,https://zoom-viral.com/news/chinatown-to-ghost-town-londons-famous-district-is-deserted-as-coronavirus-fear-spreads/?feed_id=68939&amp;_unique_id=5e356c2ab546e
DetectorReddit,1580574738,Coronavirus Panic: Cats and dogs thrown from buildings in China after fake rumours animals are causing spread,https://reportweb.co/virus-panic-coronavirus-cats-and-dogs-thrown-from-tower-blocks-in-china-after-fake-news-rumours-animals-are-causing-spread/
Tosinpeter,1580600728,Coronavirus: Government Announces Contact Persons For Nigerians In China,https://www.flameloaded.com.ng/2020/02/coronavirus-government-announces.html
nite_,1580613040,First novel coronavirus death outside China reported in Philippines,https://www.cnnphilippines.com/news/2020/2/2/novel-coronavirus-cases-death-Philippines.html
121kiwi,1580608748,China’s total number of coronavirus deaths reaches 304 as of end-February 1,https://121private.home.blog/2020/02/02/chinas-total-number-of-coronavirus-deaths-reaches-304-as-of-end-february-1/
ThatsParabolic,1580583492,"Massachusetts man has coronavirus, state health officials say; US cases rise to 8",https://www.foxnews.com/health/coronavirus-cdc-seventh-case-us
Norcan987,1580585096,'Dangerous:' social media accounts claim drinking bleach will fight coronavirus,https://www.680news.com/2020/02/01/coronavirus-bleach/
neroo-news-en,1580580681,Number of coronavirus cases in UAE rise to five with new case registered,https://en.neroonews.com/number-of-coronavirus-cases-in-uae-rise-to-five-with-new-case-registered/
neroo-news-en,1580569886,Kurdistan’s Erbil airport sends back three Chinese to Dubai over coronavirus,https://en.neroonews.com/kurdistans-erbil-airport-sends-back-three-chinese-to-dubai-over-coronavirus/
thewalletpk,1580579136,UN health agency asks all govts to take urgent action about coronavirus,https://www.thewallet.com.pk/thepage/un-health-agency-urgent-action-to-contain-coronavirus/
Shanegar,1580577498,LIVE: China coronavirus infections and death toll,https://www.youtube.com/watch?v=xpH9kM0Xfqk&amp;feature=share
WikiKnowledge,1580608050,U.S. Declares Public Health Emergency Over Coronavirus Fears,https://www.wikiknowledge.ml/2020/02/us-declares-public-health-emergency.html
WikiKnowledge,1580608050,"As coronavirus misinformation spreads on social media, Facebook removes posts",https://www.wikiknowledge.ml/2020/02/as-coronavirus-misinformation-spreads.html
kent_k,1580611029,Two People Tested For Coronavirus In Ventura County.,https://keyt.com/health/2020/01/31/two-people-tested-for-coronavirus-in-ventura-county/
Afriupdatenews247,1580619128,@Afriupdate_com: Eighth US Case Of Deadly Coronavirus Found In Boston https://t.co/JRfKVl8V28 https://t.co/T9tk84qJmx,https://mobile.twitter.com/Afriupdate_com/status/1223822456949026817
121kiwi,1580619559,New Zealand to restrict travel from China to protect against coronavirus,https://121private.home.blog/2020/02/02/new-zealand-to-restrict-travel-from-china-to-protect-against-coronavirus/
Junkie4news,1580655774,"Europeans flee China, fly to France as coronavirus death toll rises - National",https://globalnews.ca/news/6496004/coronavirus-europeans-flee/
Xurbanite,1580647598,The first case of coronavirus being spread by a person with no symptoms has been found,https://www.sciencenews.org/article/first-case-coronavirus-spread-person-no-symptoms-found-germany
Mobilenewsflash,1580657160,Solutions People Came Up With To Try To Protect Themselves From Coronavirus,https://www.sadanduseless.com/corona-virus-masks/
neroo-news-en,1580638266,More British nationals return to Europe from China amid coronavirus outbreak,https://en.neroonews.com/more-british-nationals-return-to-europe-from-china-amid-coronavirus-outbreak/
121kiwi,1580651972,British scientist sleeps two hours a night as she races to create coronavirus vaccine,https://121private.home.blog/2020/02/02/british-scientist-sleeps-two-hours-a-night-as-she-races-to-create-coronavirus-vaccine/
AmericanBornChink,1580688010,US travel restrictions go into place Sunday evening to combat coronavirus spread,https://www.cnn.com/2020/02/02/us/coronavirus-us-travel-restrictions/index.html
121kiwi,1580687967,In pictures: The Wuhan coronavirus outbreak,https://121private.home.blog/2020/02/02/in-pictures-the-wuhan-coronavirus-outbreak-2/
121kiwi,1580673564,Coronavirus: More Brits due back in UK from epidemic-hit China and set for quarantine,https://121private.home.blog/2020/02/02/coronavirus-more-brits-due-back-in-uk-from-epidemic-hit-china-and-set-for-quarantine/
121kiwi,1580666347,Coronavirus claims first life outside China,https://121private.home.blog/2020/02/02/coronavirus-claims-first-life-outside-china/
DocRid,1580669727,"Coronavirus Case Confirmed in Boston, MA",https://www.nbcboston.com/news/local/umass-boston-student-diagnosed-with-coronavirus/2070712/
Afriupdatenews247,1580662337,@Afriupdate_com: Netanyahu says Israel preparing for ‘unavoidable’ coronavirus https://t.co/Cgt5i5plLO https://t.co/Sv4zzfQQne,https://mobile.twitter.com/Afriupdate_com/status/1224007351822422016
OkQuantity7,1580705165,"Wuhan Coronavirus Looks Increasingly Like a Pandemic, Experts Say",https://www.nytimes.com/2020/02/02/health/coronavirus-pandemic-china.html
bluecapella,1580705990,"Novel coronavirus from Wuhan could transmit through human faeces, say scientists: Report",https://www.channelnewsasia.com/news/asia/wuhan-novel-coronavirus-faeces-oral-fecal-transmission-china-12384732
ChartSearch,1580706846,"Huawei, Chinese chip makers keep factories humming despite coronavirus outbreak",https://www.reuters.com/article/us-china-health-tech-huawei/huawei-chinese-chip-makers-keep-factories-humming-despite-coronavirus-outbreak-idUSKBN1ZX0CX?feedType=RSS&amp;feedName=businessNews
ARVINDBABAJEE,1580709716,https://www.cnbc.com/2020/02/03/coronavirus-latest-updates-china-hubei-wuhan-cases.html,https://www.cnbc.com/2020/02/03/coronavirus-latest-updates-china-hubei-wuhan-cases.html
121kiwi,1580702362,Coronavirus halts logging in NZ,https://121private.home.blog/2020/02/03/coronavirus-halts-logging-in-nz/
BeyrouthLego,1580647521,Escape from Wuhan - Our British Evacuation from the Coronavirus City,https://youtu.be/5XDOcHNM8-M
Afriupdatenews247,1580644326,@Afriupdate_com: Nigeria has acquired in-country capacity to test coronavirus – Minister https://t.co/qbB6fCPQys https://t.co/RYwJ05XN5x,https://mobile.twitter.com/Afriupdate_com/status/1223934647626878978
adil31111,1580673221,Thailand Doctors Found Coronavirus Cure|Dr. Kriangsak Atipornwanich|MD,https://youtu.be/ylYFFE7nfWk
neroo-news-en,1580670685,G7 countries to discuss joint response to coronavirus crisis: Germany,https://en.neroonews.com/g7-countries-to-discuss-joint-response-to-coronavirus-crisis-germany/
rootsrock,1580670807,Thai doctors find successful treatment for coronavirus,https://www.reuters.com/article/us-china-health-thailand/cocktail-of-flu-hiv-drugs-appears-to-help-fight-coronavirus-thai-doctors-idUSKBN1ZW0GQ
