author,created_utc,title,url
ColdBloodedAlec,1579796340,Deadly Coronavirus suspected to have originated from market selling wild animals for slaughter,https://www.nzherald.co.nz/world/news/article.cfm?c_id=2&amp;objectid=12302979
semeon_,1579798584,Coronavirus rose to 634 cases,https://www.cnbc.com/2020/01/23/china-coronavirus-cases-rise-to-634-as-singapore-confirms-first-infection.html
deruvo,1579771919,China coronavirus: Fear grips Wuhan as lockdown begins,https://www.bbc.co.uk/news/world-asia-china-51217455
bortzbot,1579814816,"Texas A&amp;M student at center of Coronavirus investigation in Brazos County, Texas",https://www.kbtx.com/content/news/Brazos-County-health-officials-investigating-suspected-case-of-coronavirus-567236761.html
Sad_Effort,1579784355,"There seems to be ""super spreaders"" in Wuhan coronavirus which indicates that it can spread more easily than previously thought.",https://edition.cnn.com/2020/01/23/health/wuhan-virus-super-spreader/index.html
brombinary,1579807228,WHO says 'bit too early' to declare coronavirus a global emergency,https://www.reuters.com/article/us-china-health/who-says-bit-too-early-to-declare-coronavirus-a-global-emergency-idUSKBN1ZM087
Rockithammer,1579808600,Snakes could be the source of the Wuhan coronavirus outbreak,https://www.cnn.com/2020/01/22/health/snakes-wuhan-coronavirus-outbreak-conversation-partner/index.html
lNTERNATlONAL,1579798167,Patients in Scotland tested for coronavirus,https://www.bbc.co.uk/news/uk-scotland-51223111
uncoverthenews,1579809661,Several people in Canada being monitored for signs of coronavirus: Health minister,https://www.ctvnews.ca/mobile/canada/several-people-in-canada-being-monitored-for-signs-of-coronavirus-health-minister-1.4780101
Witty_Cartographer,1579843547,Snakes May Be The Source Of Coronavirus Outbreak In China,https://www.ndtv.com/health/snakes-may-be-the-source-of-coronavirus-outbreak-in-china-2168683
AtlantaBoyz,1579815744,Patients in Scotland tested for coronavirus,https://www.bbc.com/news/uk-scotland-51223111?intlink_from_url=&amp;link_location=live-reporting-story
bornforpopcorn,1579786114,"CORONAVIRUS: More cases confirmed throughout China. Regional health authorities in China have confirmed 13 new cases of the Wuhan coronavirus, bringing the total number of cases in mainland China to 611.",https://www.cnn.com/asia/live-news/coronavirus-outbreak-intl-hnk/h_acf2b144d0e8a3fa40e96c9d270f87e5
pandas795,1579805675,Coronavirus: UK-made 'Plague' game downloads soar in China amid virus outbreak,https://news.sky.com/story/coronavirus-uk-made-plague-game-downloads-soar-in-china-amid-virus-outbreak-11915754
LtlPwny,1579818198,China coronavirus is spreading: six tested in UK as first death confirmed outside Hubei.,https://www.theguardian.com/science/live/2020/jan/23/coronavirus-china-virus-flu-scotland-testing-wuhan-live-news-updates
bornforpopcorn,1579807778,Only three Chinese regions have not reported coronavirus,https://www.cnn.com/asia/live-news/coronavirus-outbreak-intl-hnk/h_59840ec787fae15cc0c14474bdd035b6
TMcFly,1579789860,The Latest: Singapore's 1st coronavirus case is a Wuhan man,https://apnews.com/a6e3b3ca0968775520d1d75908f79b29
RawrzieOwO,1579796246,A 3rd Chinese city has been put in lock down due to the outbreak of the Coronavirus,https://www.theguardian.com/world/2020/jan/23/coronavirus-panic-spreads-in-china-with-three-cities-in-lockdown
Vrenny,1579852050,Coronavirus Live Updates: Deaths Recorded Hundreds of Miles from Center of Outbreak,https://www.nytimes.com/2020/01/24/world/asia/china-coronavirus.html
turntabulls,1579821199,CTV News: China coronavirus: WHO says virus not global health emergency.,https://www.ctvnews.ca/mobile/health/now-is-not-the-time-who-says-coronavirus-not-yet-global-health-emergency-1.4779972
bornforpopcorn,1579785237,"Coronavirus spreads more easily from person to person than previously thought, says WHO official ""(...) evidence is accruing that shows more distant contact could spread the virus, such as if a sick person were to sneeze or cough near someone else’s face.""",https://www.cnn.com/asia/live-news/coronavirus-outbreak-intl-hnk/h_2748e6c7898fd744e47b47a135c75203
eKg1991,1579821899,Texas A&amp;M Student being tested for suspected case of coronavirus,https://www.fox4news.com/news/texas-am-studentbeing-tested-for-suspected-case-of-coronavirus
paramraj,1579788770,Wuhan Coronavirus reaches US amidst a rising death toll in China,http://isbusinessbroker.com/wuhan-coronavirus-reaches-us-amidst-a-rising-death-toll-in-china/
humbleinhumboldt,1579805257,Here is an up to date map and timeline of the spread of the Coronavirus.,https://gisanddata.maps.arcgis.com/apps/opsdashboard/index.html#/bda7594740fd40299423467b48e9ecf6
_Sunny--,1579846696,Officials in Houston Testing Texas A&amp;M Student For Possible Coronavirus Infection,https://www.houstonpublicmedia.org/articles/news/health-science/2020/01/23/358285/officials-investigating-suspected-case-of-coronavirus-in-brazos-county/
bornforpopcorn,1579787266,"Coronavirus spreads more easily from person to person than previously thought, says WHO official",https://www.cnn.com/asia/live-news/coronavirus-outbreak-intl-hnk/h_2748e6c7898fd744e47b47a135c75203
drunk69,1579817493,"'Too early' to declare coronavirus outbreak a global health emergency, WHO says",https://www.nbcnews.com/health/cold-and-flu/too-early-declare-new-coronavirus-outbreak-global-health-emergency-who-n1121171
TexasChess,1579819770,Texas A&amp;M Confirms Possible Case of Coronavirus,https://today.tamu.edu/2020/01/23/texas-am-confirms-possible-case-of-coronavirus/?utm_source=feedburner&amp;utm_medium=feed&amp;utm_campaign=Feed%3A+tamuNewsFull+%28TAMU+News+Articles%29
bornforpopcorn,1579807680,World Health Organization: Wuhan coronavirus is not yet a public health emergency of international concern,https://www.cnn.com/asia/live-news/coronavirus-outbreak-intl-hnk/h_12748f97a17389ccb45a6d7961bedc11
bornforpopcorn,1579810060,Map: Tracking the spread of the deadly coronavirus,https://www.ctvnews.ca/mobile/health/map-tracking-the-spread-of-the-deadly-coronavirus-1.4780548
accessirl,1579768063,China coronavirus: Fear grips Wuhan as lockdown begins,https://www.bbc.co.uk/news/world-asia-china-51217455
Elfins,1579793647,Snakes could be the source of the Wuhan coronavirus outbreak,https://edition.cnn.com/2020/01/22/health/snakes-wuhan-coronavirus-outbreak-conversation-partner/index.html
semeon_,1579798526,Coronavirus rise to 650 cases,https://www.cnbc.com/2020/01/23/china-coronavirus-cases-rise-to-634-as-singapore-confirms-first-infection.html
chopinrocks,1579837213,Snakes could be the source of the Wuhan coronavirus outbreak,https://www.cnn.com/2020/01/22/health/snakes-wuhan-coronavirus-outbreak-conversation-partner/index.html
Black_Magic_M-66,1579846831,Chinese Authorities Begin Quarantine Of Wuhan City As Coronavirus Cases Multiply,https://www.npr.org/2020/01/23/798789671/chinese-authorities-begin-quarantine-of-wuhan-city-as-coronavirus-cases-multiply
arnaoutelhs,1579846235,"China Shutters All 70,000 Movie Theaters in Response to Coronavirus Outbreak",https://www.hollywoodreporter.com/amp/news/chinas-cinemas-officially-close-response-coronavirus-outbreak-1272566
Nihilist911,1579834453,Possible case of coronavirus being investigated at N.J. hospital,https://www.nj.com/bergen/2020/01/possible-case-of-coronavirus-being-investigated-at-nj-hospital.html
121kiwi,1579811246,"Flights Into the U.S. Are Not Being Rerouted for Coronavirus Screening, CDC Says",https://121private.home.blog/2020/01/23/flights-into-the-u-s-are-not-being-rerouted-for-coronavirus-screening-cdc-says/
timesnowpost,1579795032,US man infected with coronavirus may have put others at risk,https://www.timesnowpost.com/us-man-infected-with-coronavirus-may-have-put-others-at-risk/?utm_source=rss&amp;utm_medium=rss&amp;utm_campaign=us-man-infected-with-coronavirus-may-have-put-others-at-risk
bornforpopcorn,1579792646,China cancels plans for New Year celebrations as coronavirus spreads,https://nypost.com/2020/01/23/china-cancels-plans-for-new-year-celebrations-as-coronavirus-spreads/
PurpleDracknid,1579793496,"Four people in Scotland admitted over coronavirus fears, as Health Secretary says UK is prepared",https://www.telegraph.co.uk/news/2020/01/23/britain-braced-killer-coronavirus-says-health-secretary-infection/
bornforpopcorn,1579790134,Coronavirus news – live: Beijing cancels Chinese New Year events as two cities on lockdown and UK raises ‘huge concerns’ over outbreak,https://www.independent.co.uk/news/world/china-coronavirus-news-live-china-wuhan-outbreak-latest-symptoms-virus-a9298036.html
unnamed887,1579804423,China coronavirus: Lockdown measures rise across Hubei province,https://www.rnz.co.nz/news/world/408033/china-coronavirus-lockdown-measures-rise-across-hubei-province
mzhd,1579808642,"Wuhan, China, and 5 other cities have been quarantined as China attempts to halt the spread of the coronavirus. That's about 23 million people on lockdown.",https://www.businessinsider.com/wuhan-coronavirus-officials-quarantine-entire-city-2020-1
The_durf,1579831653,China now announces 800 infected and 25 deaths from Coronavirus.,https://www.google.com/amp/s/www.nytimes.com/2020/01/23/world/asia/china-coronavirus.amp.html
pantangeli,1579834034,"China coronavirus: 25 dead, eight cities now on lockdown",https://www.scmp.com/news/china/society/article/3047453/china-coronavirus-first-fatality-reported-outside-epicentre
fatouakinajma,1579771375,Coronavirus outbreak: China seals off SECOND major city - 18m people on lockdown | World | News,https://zoom-viral.com/news/coronavirus-outbreak-china-seals-off-second-major-city-18m-people-on-lockdown-world-news/?feed_id=50751&amp;_unique_id=5e2965ef7e454
121kiwi,1579809439,Coronavirus panic: Mystery illness fits profile of deadly Disease X warns WHO,https://121private.home.blog/2020/01/23/coronavirus-panic-mystery-illness-fits-profile-of-deadly-disease-x-warns-who/
fatouakinajma,1579815320,Nigel Farage ‘astonished’ at UK government’s response to coronavirus | UK | News,https://zoom-viral.com/news/nigel-farage-astonished-at-uk-governments-response-to-coronavirus-uk-news/?feed_id=51788&amp;_unique_id=5e2a11989e853
Afriupdatenews247,1579803433,@Afriupdate_com: Lagos alerts residents on Coronavirus https://t.co/4FeBhthof4 https://t.co/Tq1Q5Sn3u3,https://mobile.twitter.com/Afriupdate_com/status/1220397823251877888
Fortnait739595958,1579826198,Death toll of coronavirus up to 25,https://twitter.com/Reuters/status/1220504676522766343?s=19
nite_,1579879786,"2nd coronavirus case confirmed in the U.S., CDC reports",https://www.nbcnews.com/health/health-news/2nd-coronavirus-case-confirmed-u-s-cdc-reports-n1121911
Ra75b,1579895457,France declares first two confirmed cases of coronavirus,https://www.reuters.com/article/us-china-health-france/france-declares-first-two-confirmed-cases-of-coronavirus-idUSKBN1ZN2CW
jimmyolsenblues,1579915331,"China reports 1,287 confirmed cases of new coronavirus pneumonia",http://www.xinhuanet.com/english/2020-01/25/c_138732423.htm
zxkool,1579868642,Woman hospitalized in New Jersey with coronavirus symptoms,https://www.fox29.com/news/woman-hospitalized-in-new-jersey-with-coronavirus-symptoms
Keyann,1579874313,Chinese city plans to build coronavirus hospital in six days,https://www.theguardian.com/science/2020/jan/24/chinese-city-wuhan-plans-to-build-coronavirus-hospital-in-six-days
DJTisarapist,1579919632,Doctor at hospital in China's Hubei province dies from coronavirus: state media,https://www.reuters.com/article/us-china-health-doctor/doctor-at-hospital-in-chinas-hubei-province-dies-from-coronavirus-state-media-idUSKBN1ZO04P?feedType=RSS&amp;feedName=worldNews&amp;utm_source=feedburner&amp;utm_medium=feed&amp;utm_campaign=Feed%3A+Reuters%2FworldNews+%28Reuters+World+News%29
Bdub76,1579909306,"3 suspected cases of coronavirus being tested in Michigan; Washtenaw, Macomb counties",https://www.freep.com/story/news/local/michigan/2020/01/24/michigan-coronavirus-wuhan-china-disease/4566463002/
jayquez,1579923045,"Taiwan bans export of surgical, N95 masks amid China coronavirus outbreak",https://www.taiwannews.com.tw/en/news/3863692
Chaozforce,1579931429,Three Patients Under Observation in NY for Coronavirus,https://www.ny1.com/nyc/all-boroughs/news/2020/01/24/new-york-coronavirus-latest
hvis-lyset-tar-oss,1579878802,Images and videos circulate social networks of people falling dead from coronavirus,https://www.b92.net/eng/news/world.php?yyyy=2020&amp;mm=01&amp;dd=24&amp;nav_id=107843
Normiesreeee69,1579902594,Coronavirus update: As many as 63 US cases suspected as disease also spreads to Europe,https://news.lee.net/news/national/coronavirus-update-as-many-as-us-cases-suspected-as-disease/article_b0cc1c06-3ee0-11ea-87cd-6faa6e344bea.html
veksiii,1579854907,Two suspected coronavirus cases in northern Finland,https://yle.fi/uutiset/osasto/news/two_suspected_coronavirus_cases_in_northern_finland/11173752
LuckyBdx4,1579916839,"First Australian case of coronavirus confirmed in Victoria, as death toll rises in China",https://www.abc.net.au/news/2020-01-25/first-confirmed-coronavirus-case-australian-as-china-toll-rises/11900428
Mabyacommunist,1579884920,China coronavirus outbreak: Death toll hits 26 as second case confirmed in U.S.,https://www.cbsnews.com/live-updates/china-coronavirus-outbreak-chinese-lock-down-cities-wuhan-bid-to-contain-virus-today-2020-01-24/
DSCHSlash13,1579937547,First confirmed case of Coronavirus in Australia,https://www.canberratimes.com.au/story/6597940/one-coronavirus-case-confirmed-in-australia-two-probable-cases-identified/
bustead,1579919975,"Coronavirus: Second case confirmed in US, three European cases emerge",https://www.cnet.com/how-to/coronavirus-second-us-case-confirmed-in-chicago-over-1000-cases-everything-we-know/
turntabulls,1579876290,China coronavirus: Death toll rises as more cities restrict travel,https://www.bbc.com/news/world-asia-china-51230011
Froylh,1579933060,Wuhan Coronavirus may not show signs of Infection,https://www.nytimes.com/2020/01/25/world/asia/china-coronavirus.html
justabosnian,1579881431,"Second case of Wuhan coronavirus in the US confirmed - Chicago, IL",https://www.cnn.com/2020/01/24/health/wuhan-coronavirus-chicago-cdc/index.html
unnamed887,1579919436,First Australian coronavirus case confirmed; 41 now dead in China,https://www.rnz.co.nz/news/world/408141/first-australian-coronavirus-case-confirmed-41-now-dead-in-china
unnamed887,1579891848,China coronavirus: Lunar New Year subdued as outbreak spreads,https://www.rnz.co.nz/news/world/408120/china-coronavirus-lunar-new-year-subdued-as-outbreak-spreads
Joescranium,1579881803,China Races To Build A Hospital in 6 Days to Treat Coronavirus Patients,http://m.startribune.com/china-confirms-1st-death-outside-epicenter-of-viral-outbreak/567250922/
Normiesreeee69,1579879966,"Another coronavirus case has been confirmed in the U.S., this time in Chicago",https://www.nbcnews.com/health/health-news/2nd-coronavirus-case-confirmed-u-s-cdc-reports-n1121911?cid=sm_npd_nn_tw_ma
floralou,1579915844,China confirms coronavirus contagious among humans | ANC,https://www.youtube.com/watch?v=ZYQ0uzW0n7c
OverLordJesus,1579931751,China coronavirus: Death toll rises as disease spreads,https://www.bbc.com/news/world-asia-china-51245680
loi044,1579880895,Second coronavirus case confirmed in the US,https://www.bbc.com/news/world-us-canada-51213188
mrljacobs,1579919470,First Australian Case of Coronavirus Confirmed,https://www.nzherald.co.nz/world/news/article.cfm?c_id=2&amp;objectid=12303420
dausone,1579939116,WHO reports first human-to-human coronavirus infection outside China,https://www3.nhk.or.jp/nhkworld/en/news/20200125_16/
tc0843,1579887406,Tracking the Coronavirus in real time,https://gisanddata.maps.arcgis.com/apps/opsdashboard/index.html#/bda7594740fd40299423467b48e9ecf6
121kiwi,1579897629,Europe’s first coronavirus confirmed after patients tested in France,https://121private.home.blog/2020/01/24/europes-first-coronavirus-confirmed-after-patients-tested-in-france/
BiotechNews,1579892662,Chinese authorities announce first CURED coronavirus patient discharged from hospital in Shanghai,https://www.rt.com/news/479108-first-cononavirus-patient-cured/
Aboly,1579893009,Coronavirus - Google My Maps,https://www.google.com/maps/d/viewer?mid=1S0vCi3BA-7DOCS13MomK7KebkPsvYl8C&amp;hl=en_US&amp;ll=21.38142740684578%2C26.917110734739936&amp;z=2
fatouakinajma,1579898470,Coronavirus in France: Two cases confirmed as deadly virus strikes Europe | World | News,https://zoom-viral.com/news/coronavirus-in-france-two-cases-confirmed-as-deadly-virus-strikes-europe-world-news/?feed_id=53743&amp;_unique_id=5e2b5665ac20f
9Devil8,1579908157,"Coronavirus 2 cases confirmed in France, 1 in Paris and 1 in Bordeaux",https://www.independent.co.uk/news/world/europe/coronavirus-france-china-wuhan-virus-symptoms-outbreak-latest-a9301106.html
9Devil8,1579911338,France confirms 3 cases of infected people with coronavirus,https://www.independent.co.uk/news/world/europe/coronavirus-france-china-wuhan-virus-symptoms-outbreak-latest-a9301106.html
UnavailablePod,1579919386,Australia confirms first case of coronavirus,https://www.smh.com.au/national/coronavirus-case-confirmed-in-victoria-20200125-p53unk.html
Astaroth_316,1579919581,Wuhan woman 'cheated' coronavirus checks to fly out for Michelin-starred meal in France,https://www.google.com/amp/s/www.telegraph.co.uk/news/2020/01/24/ire-chinese-woman-cheated-coronavirus-checks-fly-france-michelin/amp/
fatouakinajma,1579884856,Coronavirus latest: Deadly virus CONFIRMED in Chicago as coronavirus spreads across USA | World | News,https://zoom-viral.com/news/coronavirus-latest-deadly-virus-confirmed-in-chicago-as-coronavirus-spreads-across-usa-world-news/?feed_id=53409&amp;_unique_id=5e2b21380a16f
Gistmania,1579881313,China Builds New Hospital In 10 Days To Tackle Coronavirus Epidemic,"https://www.gistmania.com/talk/topic,421602.0.html"
NotsoPG,1579924646,"China coronavirus: Death toll rises to 41; more than 1,000 cases of infection confirmed in mainland",https://www.politico.com/news/2020/01/24/china-coronavirus-death-toll-rises-to-41-more-than-1-000-cases-of-infection-confirmed-in-mainland-104051
xxExcalibur,1579938027,"The number of confirmed #coronavirus cases nears 1,300",https://www.rt.com/news/479148-coronavirus-patients-cured-china/amp/?__twitter_impression=true
valjayson3,1579874676,DISASTER ZONE Coronavirus leaves Wuhan a ‘zombieland’ with people collapsing in streets and medics patrolling in hazmat suits,https://www.thesun.co.uk/news/10808633/coronavirus-wuhan-zombieland/amp/
protekt0r,1579875391,College student in Texas quarantined with suspected coronavirus,https://thehill.com/homenews/state-watch/479708-college-student-in-texas-quarantined-with-suspected-coronavirus
popcorn1221,1579870863,America Scientists warned virus could ‘escape’ from lab near coronavirus epicentre,https://metro.co.uk/2020/01/24/us-warned-virus-escape-lab-near-coronavirus-epicentre-12114591/
nite_,1579879688,"1st case of coronavirus confirmed in Chicago, CDC says",https://wgntv.com/2020/01/24/1st-case-of-coronavirus-confirmed-in-chicago-cdc-says/
Nihilist911,1579879231,1st case of Chinese coronavirus confirmed in Chicago,https://wgntv.com/2020/01/24/1st-case-of-chinese-coronavirus-confirmed-in-chicago/
protekt0r,1579880655,"Another coronavirus case has been confirmed in the U.S., this time in Chicago",https://www.nbcnews.com/health/health-news/2nd-coronavirus-case-confirmed-u-s-cdc-reports-n1121911
LorenzoBagnato,1579857801,"Coronavirus has a mortality rate of roughly 3%, killing only elderly people or those with a weak immune system.",https://www.wsj.com/articles/what-we-know-about-the-wuhan-virus-11579716128
bornforpopcorn,1579896770,First European cases of coronavirus confirmed in France,https://www.cnn.com/asia/live-news/coronavirus-outbreak-hnk-intl-01-24-20/h_6bc0d3335266fcf5b009351eda63e25f
vintage_93,1579893257,"US - Media Advisory: CDC Telebriefing: Update on 2019 Novel Coronavirus (2019-nCoV) Today at 10 am ET - January 24, 2020",https://flutrackers.com/forum/forum/-2019-ncov-new-coronavirus/824296-us-media-advisory-cdc-telebriefing-update-on-2019-novel-coronavirus-2019-ncov-today-at-10-am-et-january-24-2020
jajanken_twat,1580024101,"Coronavirus Case conformed in Orange County, California",https://www.nbclosangeles.com/news/orange-countys-first-novel-coronavirus-case-confirmed/2298278/
d01100100,1579995297,A man diagnosed with Wuhan coronavirus near Seattle is being treated largely by a robot,https://edition.cnn.com/2020/01/23/health/us-wuhan-coronavirus-doctor-interview/index.html
cmpnd499,1579962393,"Suspected coronavirus in Denver, Colorado",https://www.denverpost.com/2020/01/24/coronavirus-denver-lakewood-colorado/
RoseSparxs,1580006638,"More than 2,000 now infected with coronavirus; 56 dead in China",https://www.reuters.com/article/us-china-health/more-than-2000-now-infected-with-coronavirus-56-dead-in-china-idUSKBN1ZP02B
shy311,1580000895,Canada confirms first case of coronavirus,https://www.cbc.ca/news/canada/toronto/canada-1st-case-coronavirus-toronto-1.5440760
c0brachicken,1580003333,"China is Building Two 1000-1300 Bed Hospitals In Wuhan To Fight Coronavirus, 1st in 6 days, 2nd in 15 days.",https://news.sky.com/story/coronavirus-china-to-build-two-wuhan-hospitals-in-under-three-weeks-11917336
Taylor1991,1579970287,Possible case of Coronavirus at Raleigh-Durham International Airport in N.C.,https://www.wbtv.com/2020/01/24/possible-case-coronavirus-nc-under-investigation/?utm_medium=social&amp;utm_source=facebook_WBTV_News
ThisGiftIsSoCool,1580000164,"China coronavirus spread is accelerating, Xi Jinping warns",https://www.news.com.au/lifestyle/health/china-coronavirus-spread-is-accelerating-xi-jinping-warns/news-story/d5c2e662c432acc1d8c281b0eda50028
larzast,1580025553,"More than 2,000 now infected with coronavirus; 56 dead in China: Reuters",https://reut.rs/2sXKFZj
unnamed887,1579977823,"China coronavirus spread is accelerating, Xi Jinping warns",https://www.rnz.co.nz/news/world/408153/china-coronavirus-spread-is-accelerating-xi-jinping-warns
OverLordJesus,1579993295,Health officials announce ‘presumptive’ case of coronavirus in Toronto,https://globalnews.ca/news/6462626/coronavirus-toronto-hospital/amp/
dausone,1579939716,Coronavirus: First case of human-to-human transmission confirmed outside China (&lt;7 day incubation period),https://www3.nhk.or.jp/nhkworld/en/news/20200125_16/
Barrkilledepstein,1580001756,China's Hubei province reports 13 new coronavirus deaths: state media,https://www.reuters.com/article/us-china-health-hubei/chinas-hubei-province-reports-13-new-coronavirus-deaths-state-media-idUSKBN1ZP018?feedType=RSS&amp;feedName=topNews&amp;utm_source=feedburner&amp;utm_medium=feed&amp;utm_campaign=Feed%3A+reuters%2FtopNews+%28News+%2F+US+%2F+Top+News%29
Vrenny,1579981263,Coronavirus contagion rate makes it hard to control: studies,https://www.reuters.com/article/us-china-health-transmission/coronavirus-contagion-rate-makes-it-hard-to-control-studies-idUSKBN1ZO0QW
Xenjael,1579974535,Live interactive heat map (Global) of the Coronavirus created by Johns Hopkins University.,https://gisanddata.maps.arcgis.com/apps/opsdashboard/index.html#/bda7594740fd40299423467b48e9ecf6
semeon_,1579977578,This map shows the latest spread of the coronavirus,https://www.cnbc.com/2020/01/23/this-map-shows-the-latest-spread-of-the-coronavirus.html
Wendfina,1580003944,Chinese tourist says she evaded coronavirus checks to fly to France,https://www.theguardian.com/science/2020/jan/23/chinese-tourist-says-she-evaded-coronavirus-checks-fly-france
kotalover,1579994418,First Canadian coronavirus case confirmed in Toronto,https://www.thestar.com/?redirect=true
unnamed887,1580007287,Coronavirus spreading rate makes it hard to control - studies,https://www.rnz.co.nz/news/world/408174/coronavirus-spreading-rate-makes-it-hard-to-control-studies
luisgustavo-,1579995315,Coronavirus patients arrived in France without symptoms,https://www.reuters.com/article/us-china-health-france-idUSKBN1ZO0NB
leonx81,1580025366,"Third US case of coronavirus confirmed in California, health officials say",https://www.cnbc.com/2020/01/26/third-us-case-of-coronavirus-confirmed-in-california-health-officials-say.html
Naruto9USA,1579962404,Turkey Sends Suspected Coronavirus Patient Back to China,http://m.bianet.org/english/world/219112-turkey-sends-suspected-coronavirus-patient-back-to-china
me_colin,1579946896,"Australia confirmed its first four cases of the new coronavirus in two different cities on Saturday, with the country’s chief health official saying he expected more cases as Australia was a popular destination for Chinese tourists.",https://www.reuters.com/article/us-china-health-australia/australia-confirms-four-cases-of-coronavirus-expects-more-cases-idUSKBN1ZO02N?feedType=RSS&amp;feedName=topNews
unnamed887,1579998859,Sydney flight key link in Australia's effort to contain coronavirus,https://www.rnz.co.nz/news/world/408167/sydney-flight-key-link-in-australia-s-effort-to-contain-coronavirus
Cultural_Switch,1580004314,New coronavirus can spread between humans—but it started in a wildlife market,https://www.nationalgeographic.com/science/2020/01/new-coronavirus-spreading-between-humans-how-it-started/
bornforpopcorn,1579957659,LATEST: Three coronavirus cases now confirmed in France,https://www.thelocal.fr/20200125/coronavirus-cases-confirmed-in-france
leolinden,1580021997,Coronavirus Postpones Chinese Competitive League of Legends League,https://www.dailyesports.gg/coronavirus-causes-lpl-to-postpone-week-two/
qmannu,1580022381,"US arranging charter flight to evacuate American diplomats and citizens out of China amid coronavirus outbreak, official says",https://news.google.com/articles/CAIiEKcnh7oLeHqVjJOyn62nN-MqGQgEKhAIACoHCAowocv1CjCSptoCMPrTpgU?hl=en-US&amp;gl=US&amp;ceid=US%3Aen
